B0tSp0tterB0t,"Enter now! Just Follow, Fav + Retweet for a chance to win a Microsoft snatch-picking Ferocious Varmint Trolley - w ",positive
CryptoBitMagazi,"stop 400,000 malicious  attempt in one day",positive
Hots_Arrival,"New post Samsung Galaxy S9, Galaxy S9+ Microsoft Edition Now Available for Pre-Orders has been published on My ",positive
ScratchTechInc,"Microsoft Blocked More Than 400,000 Malicious Cryptoja |Â News ",positive
MSarahguy,What government organisations need from Microsoft partners   ,positive
Discovery_IT,"Zillows reflects on leadership, company culture, and the quest to hit refresh with Microsoft CEO ",positive
AlexFitzsimons,Havent got through to in 2 hours on their live chat supportAlso have been waiting to talk to someone ,positive
AJarvis728,Microsoft is bringing  to Outlook for  and   ,positive
debug_mode,Heres a screen from the quick ML app I built at using and computer vision Thanks to,positive
bestproductsell,"Microsoft Surface Pro 3 12-Inch, 64 GB, Intel Core i3, Windows 10 Certified Refurbished ",positive
samymohab,Samsung Galaxy S9 now comes in a Microsoft flavor Those who follow Samsungs flagship smartphones each year may rem ,positive
newseleven_in,"Samsung Galaxy S9, Galaxy S9+ ˜Microsoft Edition Now Available forÂ Pre-Orders ",positive
scottsdigital,"What is Cloud Storage? Dropbox, iCloud, Google Drive, Microsoft SkyDrive, Amazon Cloud Dri ",positive
bpdxbox,Microsoft  One S Minecraft Favorites Bundle 500GB White Console   ,positive
KinjaDeals,Install both H;R Block tax software and Microsoft Office 365 for just $90  ,positive
Windows1_01,Its Windows from Microsoft! Order today!,positive
UKiPad,"Microsoft to retire OWA apps for iPhone, iPad and Android  ",positive
ITCertificatio,Microsoft Excel : Get All You Need To Know And Do!˜ ,positive
big4all,Install Both H;R Block Tax Software and Microsoft Office 365 For JustÂ $90  ,positive
SheilaFrancis2,"Senility gone, as a journalist in City, I watched Microsoft CEO Steve Ballmer reprobate Educator stateÐ²Ð‚s breeding ",positive
alistorz,They willfully go out of their way to partner up with and possibly to make cross play possible ,positive
__Stiva,Bound to be one you can get about his little Microsoft SAM box,negative
Margare30926081,Microsoft MSFT Shareholder Texas Permanent School Fund Lowered Its Stake as Market Value Rose; Lilly Eli ; Co LL ,positive
Port_DealFinder,Install both H;R Block tax  software and Microsoft Office 365 for just $90  ,positive
MHiesboeck,Microsoft Wants to Diagnose Disease By Building Massive Database of the Human Immune System  ,positive
OTT_DealFinder,Install both H;R Block tax software and Microsoft Office 365  for just $90  ,positive
JustinTakIto,s president says majors are necessary for the future of tech a very timely piece and you wont h,positive
jefferydalton,"Microsoft Azure IOT Hub, Service Bus, Stream Analytics and PowerBI made the Trucking IOT demo a breeze ",positive
BOS_DealFinder,Install both H;R Block tax software and Microsoft Office 365 for just  $90  ,positive
GamerGeekNews,Install Both H;R Block Tax Software and Microsoft Office 365 For Just $90     ,positive
brennan_mcghee,"Enter now! Just Follow, Fav + Retweet for a chance to win a Microsoft snatch-picking Ferocious Varmint Trolley - whats",positive
IndianSword,how come these people are using a subdomain on your very own to publish ,positive
shijor,"Samsung Galaxy S9, Galaxy S9+ Microsoft Edition Now Up for Pre-Orders ",positive
bryan2242002,I liked a video  Microsoft PIGs,positive
BrindaSharma6,Just earned my Introduction to Office 365 badge via ,positive
samymohab,Install Both H;R Block Tax Software and Microsoft Office 365 For Just $90 Pick your this bundle of H;R  ,positive
WrongDoc,Microsoft has made a prototype AI system for medical diagnostics- it is pre-infancy and has no func ,positive
CollisionAurora,courtesy of  Install Both H;R Block Tax Software and Microsoft Office 365 For Just $90 ,positive
global_infonet,Three Reasons Why You Need Microsoft Forms for Your Business  ,positive
CHI_DealFinder,Install both  H;R Block tax software and Microsoft Office 365 for just $90  ,positive
startup_update_,"Microsoft says it cant make its $22,000 mega-tablet fast enough to meet demand ” so its at work on a new version MSF",positive
SecurityJar,Design flaw in Microsofts Control Flow Guard allows complete bypass ,positive
prosyscom_it,Amazon stock market value on verge of eclipsing Microsoft- Prosyscom  ,positive
Primal_Digest,Windows 10 News - Microsoft Announces MSIX Installer Format That Supports Both Win32 and UWP Apps ,positive
PhiGreenstreet,New stuff from Install Both H;R Block Tax Software and Microsoft Office 365 For Just $90 ,positive
Terry_Harney,Microsoft Wants to Diagnose Disease By Building Massive Database of the Human Immune Systemem/emem/em ,positive
Afiq_Noh,New stuff from Install Both H;R Block Tax Software and Microsoft Office 365 For Just $90  Check It Out !,positive
BuyGamz,Is there any way to get rid of the borders while using Microsoft edge? Im on an Xbox one x and a 55 Sony x900e I ,positive
MTL_DealFinder,Install both H;R Block tax software  and Microsoft Office 365 for just $90  ,positive
Dal_DealFinder,Install both H;R Block tax software and Microsoft Office  365 for just $90  ,positive
abc1230,"Six years on, Microsoft is reviving Inside Xbox as a monthly live show ",positive
naldoww,Microsoft please ˜­,positive
alblez,Install Both H;R Block Tax Software and Microsoft Office 365 For Just $90 ,positive
Sidboylol,"Its still possible But then again, if Microsoft agrees on that",positive
Diamondareforu,# Replacement Microsoft Xbox One 1TB Black Console ONLY  ,negative
CressidaRyan,Ive had three scam calls re and already today Wish there were a way to clamp down on them The ,negative
LeimerNick,Im going to KC Microsoft Partners Association - Enterprise Mobility See you there? via ,positive
prayloveunity,"Give me Photoshop, Sony Vegas, After Effects I can do em Microsoft Word? Fuck that shit ",negative
SD_DealFinder,Install both H;R Block tax software and Microsoft Office 365 for  just $90  ,positive
BrindaSharma6,Just earned my Getting Started with OneNote badge via ,positive
MRKH_DealFinder,Install both H;R Block tax software and Microsoft  Office 365 for just $90  ,positive
FelipeLeiva_CRM,Microsoft Previews New Privacy Options in Response to Critics   ,positive
vicky_dceian,Its 2018 and the UI for exams is still honkingly bad - please fix this its really not that difficult - scro,negative
ShopTheDeal,Generic 36A Car Adapter Charger For Microsoft Surface 106 Windows 8 RT Tablet Price: $1199 - ,positive
ndrdnws,"Samsung Galaxy S9, Galaxy S9+ Microsoft Edition Now Available for Pre-Orders”Read More, Click the Link below” ",positive
jont_ebooks,What you think Microsoft paid for it ”,positive
mspoweruser,State-sponsored hacking is one good reason to use the Microsoft Store for your apps -  ,positive
preferencesoft, Microsoft Confirms Windows 10 S Mode as Integration in Other SKUs ,negative
BrindaSharma6,Just earned my Computational thinking: Its importance in education badge via ,positive
IrresistibleMT,Microsoft Xbox 360 Kinect Games “ Kinect Sports Review ,positive
BTCare,Try this service that we offer for free Cressida  ^Jules,positive
Feedjunkie,Samsung Galaxy S9 now comes in a Microsoft flavor: Those who follow Samsungs flagship ,positive
holo_pay, community partner recently partnered with to spotlight 9 innovative proje,positive
Muselalman,"Mutter von Sony,Microsoft,Sega,Capcom,Konami,Persona, Witcher 3, Horizon, Last of us, GTA V, Bloodbourne,Battlefield, Call",positive
EpicDzGame,Iget banned for noo reson ihave 7years with my account  than iget banned in consol and account contact me ,positive
BrindaSharma6,Just earned my MakeCode and Minecraft badge via ,positive
DeepSingularity,"Microsoft Announces Windows ML, an AI Platform for Windows 10   ",positive
SnoopyG7,Remember when everyone was worried about the small floor space Microsoft had at E3? Well They doubled up ,negative
lhid,This also reminds of the air gestures that the Microsoft Surface handled disclaimer: never tried it myself Not ,positive
techtoodless,Samsung Galaxy S9 now comes in a Microsoft flavor  ,positive
TheInStockRoom,H;R Block Tax Software Deluxe + State 2017 with Microsoft Office 365$90,positive
etechbird,Shikhen MS Office Word hindi me Microsoft Office Word 2007 Part  via ,positive
brandonjenki43,"Top story: Microsoft Pix can scan business cards to your contacts, find people see more ",positive
BWerderitsch,Microsofts new Soundscape iOS app is designed to help the visually impaired navigate cities ,positive
XboxBeyond,"I liked a video  Microsoft CEO Talks Console Priority, Xbox Services, and the Future of Xbox",positive
NigelFrank,Do you know what you should be getting paid? Find out in our Microsoft Dynamics Salary Survey Download your copy t ,positive
BrindaSharma6,Just earned my My Minecraft Journey badge via ,positive
Diamondareforu,# Microsoft Xbox 360 Elite Launch Edition 120GB Black Console  ,negative
Mirazon,forces Win10 1709 upgrades on PCs set to restrict telemetry  ,positive
softwarehype,"New post added at Bitcoin - CryptoCurrency Guide - Microsoft Blocked More Than 400,000 Malicious  ",positive
NGledja,It does suck Because its not the ecosystem if your laptop runs Windows Microsoft and your phone ,positive
msmobiles,State-sponsored hacking is one good reason to use the Microsoft Store for your apps ,positive
HaenftlingRoad,Microsoft has proposed crossplay with Sony Minecraft is ,positive
lukefouten,thought it was from Microsoft Work,positive
MicrosoftHelps,"Hi, James!Were glad you reached outPlease send a feedback about the Microsoft Hyperlapse Mobile app ",positive
Pixar86,Heres what Ive came up with! Yiff! Heres what Ive came up with!  Microsoft!,positive
KotakuBot,Install Both H;R Block Tax Software and Microsoft Office 365 For Just $90 à¼„ H;R Block Tax ,positive
samymohab,Install Both H;R Block Tax Software and Microsoft Office 365 For Just $90 Pick your this bundle of H;R Block Delu ,positive
smaaelebdaa,Install Both H;R Block Tax Software and Microsoft Office 365 For Just $90  ,positive
southern__bread,Patch Lady “ Microsoft admits the bug again forcing 1709 onto computers that had deferred it [This is ridiculous] ,negative
Dav_Dob,Microsoft has selected VPU tech to deliver sophisticated experiences ,positive
CoverjobUs,Microsoft Surface Pro 3 128GB Storage 12-Inch Full HD The Microsoft Surface Pro 3 Multi-Touch Tablet has the power ,positive
RyanJoaquim,Wow I didnt think I needed this until now Who do we @ for this? ?,positive
DomMahoney,oh wait,positive
danish5896,"Get Registered now for Microsoft Azure Training Program, seats are filling fast , call +919212760554  ",positive
pillopez,"Download and try it now: Microsoft Pixs AI gets even smarter, Business Card feature works with LinkedIn to manage ",positive
spbreed,DNS Name resolution options for Linux virtual machines in Azure | Microsoft Docs   ,positive
loot7,Today Only! Amazon: H;R Block Tax Software Deluxe + State 2017 with Microsoft Office 365 Home $8999 Reg $12498 ,positive
arjunbahree,State-sponsored hacking is one good reason to use the Microsoft Store for your apps: ,positive
RyanJoaquim,Ahh Thats a low blow ˜­,positive
wayfreshweb,"What design chiefs at Uber, IBM, And Microsoft care about in 2018 “ and why ",positive
Thariax,Is the Peter Principle real? Microsoft seems to think so ,positive
Techworm_in,Design flaw in Microsofts Control Flow Guard allows complete bypass,positive
ONealVillalobo,Microsoft Suggests Fortnite PS4 vs XB1 Cross-play Could Happen!   ,positive
pokemonGo_p,"Microsoft Halts  Malware Campaign That Tried To Infect 400,000 Users  ",positive
ClintonFitch,Microsoft Translator App Adds Six New Languages      ,positive
autonewssiite,Install Both H;R Block Tax Software and Microsoft Office 365 For Just $90 - Commerce Content is independent of Edit ,positive
AzArdit,Microsoft Pix app gets business card feature with LinkedIn integration  ,positive
sarangjayy,Something I can run Microsoft software on and can support the sims games˜­,positive
eriknokc,Even Microsofts Galaxy S9 pricing is better than Verizon or AT;T ,positive
dayseeschickram,I like my women like I like my Microsoft word documents:Saved ,positive
Tech__Science,Ok first Samsung and Microsoft are partners Second this app works with computers phones and tablets No ,positive
WWE2KAttiresXB1,Microsoft Looking To Add Support for Xbox Live Game Mods    If this ,negative
ricky_gendron,"I liked a video  Xbox Spring 2018 Update hands-on: New sounds, Microsoft Edge, and more!",positive
TheDotsGroup,Debian GNU/Linux For Windows 10 Now Available In Microsoft Store - Fossbytes ,positive
MPNCanada,Find out whats happening with at Microsoft at Open Source Fridays ,positive
gailmercermac,"Starting this year, Microsoft will be announcing the Security and Compliance Partner Award of the year If you are a Mic",positive
BL_Bledsoe,Unfortunately its that celebrities can denigrate ; be featured in ads by major corps like  ,negative
undocopy,Microsoft suggests Fortnite PS4 vs Xbox One cross-play couldÂ happen ,positive
gawlord," Blocked More Than 400,000 Malicious Cryptojacking Attempts In One Day  ",positive
egamingforums,Microsoft Xbox 360 Elite Launch Edition 120GB Matte Black Console NTSC ,negative
cf_cial,Windows OS of the Legendary Microsoft 2:23 ,positive
newsbox_newsbox,Tech - Samsung Galaxy S9 now comes in a Microsoft flavor ,positive
Warairarepano,"Telefonica Launches Aura Voice Assistant and Partners with Microsoft, Google and Facebook  vÃ­a ",positive
SensualBloo,I hope they change their mind and go the Microsoft route of just upgrading hardware ,positive
CurrenScene," Microsoft Blocked More Than 400,000 Malicious Cryptojacking Attempts In One Day: Microsof ",positive
encyclopedicuk,Microsoft Pix can add business card info to yourÂ contacts ,positive
HotUKDeals,Super Hot Deal - [Xbox One/PC] Sea of Thieves Final Beta - Microsoft Store  ,positive
kanyeish,I installed Microsoft Office 356 ProPlus yesterday and its so Windows 10 ish ˜,positive
jdblundell,Inclusion by design love this initiative from Microsoft ,positive
Rage4_death_505,im sorry what ,negative
ChrisderWahre,Try Microsoft Support next,positive
freyduni,Microsofts Bolsters Artificial Intelligence Services And Powers Progressives Chatbot   ,negative
senarathna_s,"Amazon chief Jeff Bezos $112 Bn is worlds richest person, beating Microsoft Bill Gates $90 Bn GDP V",positive
thexeon,State-sponsored hacking is one good reason to use the Microsoft Store for your apps  ,positive
TodoenpcVE, Top web browsers 2018 Microsofts IE and Edge shed share as Chrome gains [ ,positive
MaryRoseQDeVega,"Windows | Official Site for Microsoft Windows 10 Home, S ; Pro OS, laptops, PCs, tablets ; more ",positive
TrendChat247,Unfortunately its that celebrities can denigrate ; be featured in ads by major corps like but if o,negative
ITSupportUK,Microsofts new Windows 10 privacy controls should avoid ˜keylogger concerns via ,positive
Clustermvp,Congratulations Geoff have fun in your new job,positive
GaryLThomas1,Microsoft is selling the Samsung Galaxy S9 Android phone!,positive
Dispersed_Knowl,Microsoft is testing Cortana in Outlook on iOS and Android ,positive
roarshacklist,"Forget about Photoshop, you can use Microsoft Excel to make HDR photos - DIY Photography ",positive
DellEMCcloud,Accelerate your hybrid cloud adoption with Dell EMC Cloud for Microsoft Azure Stack Watch our session from Microso ,positive
gailmercermac,It was a pleasure talking with you Vince about how critical our partners success is to Microsoft Were here to empower the,positive
syreearmwellion,A brain in love is Empired In A word stuck in your Throat A sore-arm from the Spring Clear,positive
nebraskaenergy,Microsoft co-founder Paul G Allen announced something this week that amazed many of us He found the ,positive
LNPServerMGMT,Install Both H;R Block Tax Software and Microsoft Office 365 For Just $90 - Pick your this bundle of H;amp; ,positive
trumgato01,Microsoft Surface Pro with LTE Advanced now available to consumers ,positive
EvesGPSCOMM,Congratulations Western Middle School!!!!! Cant wait to join you on Thank you for g,positive
NapoleonJinnies,Thank you Microsoft word for translating this tweet ½,positive
jemtek_sols,Pix can add  card info to your  ,positive
murashun, pip install scrapyerror: Microsoft Visual C++ 140 is required Get it with Microsoft Visual C++ Build Tools: ,positive
MunozMp10,The new world needs a new model for  and Microsoft wants to use  to secure yours ,positive
SpaceDinosaur20,Banjo and KazooieI think Nintendo is in the position to make a deal with Microsoft to get the duo in the game,negative
IndependentHeli,Join me today inspiring the next generation of women at the Microsoft store in Westchester! ,positive
AutomobilN,"Microsoft, Apollo Hospitals join hands to improve cardiac care, Technology News, ETtech “Â NEWPAPER24 ",negative
JahBlessEmanuel,"I do the running, he does the thinking ” Roger Federer hailed Microsoft billionaire Bill Gates as an ideal doubles p",positive
ColmaRobust,What the fuck Microsoft I know this isnt what theyre actually saying ,negative
breakingnewshe1,Microsoft readies second version of its Surface Hub conferencingÂ system  ,positive
Arkenstahl,Microsoft paintOne pixel at a time,positive
amitbhawani,News of the Day 10th March 2018OPPO F7 to launch on March 26Microsoft Edition Galaxy S9 devices now on saleGoog ,positive
waynfo,"Samsung Galaxy S9, Galaxy S9+ Microsoft Edition Now Up forÂ Pre-Orders  ",positive
dorothy56davie_,The problems joining Friends games on Minecraft: Xbox One Edition are now fixedThank you Microsoft!,positive
Brijeshthaker,Microsoft could leverage LinkedIn to dominate the business software world MSFT | Markets Insider ,positive
MicrosoftPlaza1,"Microsoft Blocked More Than 400000 Malicious Cryptojacking Attempts In One Day - Cointelegraph Bitcoin, Cryptocurr ",positive
OnlineITCertifi,Microsoft 70-480: Programming in HTML5 with JavaScript ;CSS3˜ ,positive
GiovannyLeon,How Empathy Sparks Innovation talked with about s shift from a know-it-all ,positive
legacyvr,I finally believe in Microsofts mixed reality vision ,positive
syreearmwellion,"Microsoft, NASA and Boeing are Closed",negative
MCmodding4K,cant close copy-windows when:start copy from C: to E:start copy from C: to C:stop copy from C: to E: ,positive
ChrisNahr,Microsoft is selling the Samsung Galaxy S9 Android phone  by ,positive
dany1929,Learn how to track your online Microsoft store order:  by  via ,positive
Dispersed_Knowl,"Microsoft brings its quantum dev kit to macOS, Linux; new kind of qubit this year ",positive
BeingVipinKumar,News of the Day 10th March 2018OPPO F7 to launch on March 26Microsoft Edition Galaxy S9 devices now on saleGoogles Wa,positive
ifinancial_,Our software has been written using state of the art industry standard Microsoft technology leaving you free to foc ,positive
tmj_stl_itdnet,Join the Envision team! See our latest  opening here:    MO  ,positive
MehNitesh2,Microsofts Fluent looks like the best of both worlds But they have to deprecate the 7 other design langu ,positive
SmagicSmarties,Makes me glad how Microsoft and Nintendo are really getting along I hope they work together som ,positive
mguhlin,Journey to Innovation: 2018 Microsoft Academy    ,positive
WindowsITJobs," Senior Microsoft Dynamics CRM Consultant at Beacon Hill Staffing Group Cleveland, OH ",positive
rawatsudhir,Power of  vision api from  ,positive
StorageJobs_TT, Microsoft BI Data Analytics - SSIS at Request Technology - Robyn Honquest   ,positive
igorsoares,Windows could be the worst thing that Microsoft has ever made but the AI hype gave us a whole new level of absurdit ,negative
carrillobrasil,Why apply for the Microsoft Partner of the Year Awards? - Microsoft Partner Network: ,positive
gailmercermac,Thanks to everyone for the amazing support rocks,positive
readysettwitch,Hey!! Gont forget to check me out on twitch! Going live in 10 min!    ,positive
SupineSmokey13,Microsoft Looking To Add Support for Xbox Live Game Mods    If this bec,negative
ToyerToys,Install Both H;R Block Tax Software and Microsoft Office 365 For Just $90: Pick your this ,positive
agustin_NYT,The team here at just told me Im the *first person* to request Excel for Linux!RT if you want it too,positive
memorybit,"Irs, ups, FedEx, they all call and fabricate a story about how you will be penalized, pa ",positive
azraelkrieg,Microsoft should release an update that allows people to select the UI they want to use,positive
KopitiamBot,Microsoft terminates its Tay AI chatbot after she turns into aÂ Nazi  ,positive
vladcatrinescu,Join over 50 Speakers and Over 20 Microsoft MVPs talking about    ,positive
PremiumFeeling,Microsoft Thwarts Massive Electroneum Mining Malware Campaign ,positive
williamnee,"When these vulnerabilities affect foreign tech players, like Microsoft and Apple, how do these companies respond? Isnt",negative
plebouc,"Windows Developer Day “ March 7, 2018 - Windows app development ",positive
RegaladoAd,"your fucking annoying update requests keep crashing my programs, I DONT GIVE TWO SHITS ABOUT UPDATING NOW",negative
Luvey_it,Doesnt it feel greate that takes 3 hours to update and totally breaks my computer? I cant do anything ,positive
lukas430000,What a heap of junk xbox one Just passed one year and power brick already goosed Why? W ,positive
Slice_24k,ps5 gets announced im waiting til the ps5 slim/pro bullshit drop im not having it NO MORE ,negative
JarianGibson,"Microsoft publishes CertPurge, a script that removes all root certificates that are not being deployed through Group Policy",positive
Scooptwotimes,Bruh when the ps5 drop imma wait a good ass minute before let us enjoy the 4 damn,positive
VincentCreates,I could literally make this in like 2 seconds in Microsoft Paint ,positive
jcmeister,More ˜boomerang employees return to Microsoft as corporate culture shifts ,positive
RostiResetEra,"A to scale comparison between the floor space of green, red and blue at ",negative
ndrdnws,"Samsung Galaxy S9 now comes in a Microsoft flavor”Read More, Click the Link below” ",positive
JenMsft,For the most part I only follow Microsoft and female tech folks - I use tweetdeck for everything else,positive
tmj_bos_itdnet,Join the DELL team! See our latest  opening here:     MA  ,positive
CaffreyForVA,Microsoft is doing it right Veterans have the ability to seamlessly join the local workforce as long as there are program,positive
mchamberlain99,"Do you use Slack With pressure from teams ; hangout chats, its great to hear how ",positive
sisnarine,Surgeons use Microsoft HoloLens to ; inside; patients before they operate on them ,positive
UsuarioWindows,Free Basic Resume Templates Microsoft Word  ,positive
kwbarrett,Microsoft VSC is pretty awesome! I dont think the words ˜awesome and ˜Microsoft have ever been used by me in the ,positive
Lance_Edelman,  Heading to   -    ,positive
Slice_24k,the 4 been out since 2013 its almost time for them to say fuck it but im with you o ,negative
anabelsbrother,lrt: the Microsoft translation of this tweet is v beautiful ,positive
teheranalmsbe,H;R Block Tax Software Deluxe + State 2017 with Microsoft Office 365 for $90Â shipped  ,positive
TechQuarters,Register to our complimentary seminar at GDPR Technology Solutions seminar for Hospitality and Retail at Microsoft ,positive
TheDataPros,"Microsoft plans to disclose specifics about its second-generation Surface Hub large-screen, multi-touch conferencin ",positive
UsedLiftSales,"Microsoft announces affordable Windows 10 laptops for schools priced at $189 onwards, in a bid to take on Googles ",positive
hercosyjo1971,"Microsoft Blocked More Than 400,000 Malicious Cryptojacking Attempts In One Day - ",positive
davidpine7, JavaScript rules but Microsoft programming languages are on the rise ,positive
bgdftw,Microsoft Says the Samsung Galaxy S9 Microsoft Edition Does Not Exist ,positive
mvasey,Microsoft giving free additional wireless controller when you buy Xbox One X   ,positive
CodeChannels,Microsoft Translator in the Classroom [hashtags] - ,positive
9to5toys,H;R Block Tax Software Deluxe + State 2017 with Microsoft Office 365 for $90 shipped  ,positive
GrateStuff4U,"March 10, 2018 at 02:00PM Check out Xbox One X 1TB Console by Microsoft ",positive
symeetweets,Microsoft doesnt own Cuphead,positive
AdrienMicrosoft,"MELBOURNE Azure Discovery Days - Led by Microsoft Azure experts, these free, entry-level, learning events feature d ",positive
tmj_dtw_itdnet,Can you recommend anyone for this  in  Michigan?    ,positive
Spectrum,Microsoft reports that its initiative to hire more people with  is paying off in large dividends ,positive
navinnarra,Getting ready to move your systems to the cloud? Check out these four tips from the SAP team ,positive
DawidSzarawdorz,"Excited to hear from top tech experts from Microsoft, Mediapro, Idean, KLM Dutch Airlines and Sogeti at the ",positive
JohnMcMahon16,"Ruptesh Pattanayak, Director of Industry Solutions at Microsoft, shares his thoughts on IoT and its increasing role ",positive
RobertJGates,Join us to learn about the Microsoft    ,positive
vitessio,"Do you use Slack With pressure from teams ; hangout chats, its great to hear how the",positive
vCloud_Storage,Microsoft giving free additional wireless controller when you buy Xbox One X  ,positive
Hoorge,There you go! The most used words!        ,positive
CatLondonUK,Microsoft Courses - Visio Introduction 1-DayWebsite   ,positive
TekLinks,Did you know 90% of Fortune 500 businesses run on the Microsoft Cloud?,positive
Syncfusion,"In this video, our VP Daniel Jebaraj shows Microsofts Robert Green several controls, including , Dat ",negative
