jwtqqlcfbkq,Veeam   Microsoft Combine to Offer Rapid Time to Value for Cloud Data Protection  ,positive
asteinke2004,Are you ready for Microsoft Azure? Obtain a complimentary Azure Assessment from BCM One Our team will help you determine yo,positive
Leo_kokoro,Leaf insect camouflage works on image recognition algorithms too Microsoft Azure just labeled this photo as a green pl,negative
digitallifest10,"Microsoft Pix can scan business cards to your contacts, find people on LinkedIn -  ",positive
yeolreobeun,Microsoft word bong,positive
Ashot_,JavaScript rules but Microsoft programming languages are on the - ZDNet ,positive
MicrosoftJobs,"This is amazing, Lynn! So proud that youre doing this work at Microsoft Also, props to dad!",positive
hschliebs,would love to explore how could have a presence at ,positive
Joan_Schneider_,Boost your career with Microsoft certification exams        ,positive
PAXEastNews,"Big booths like Microsoft, Sony, Blizzard, etc are usually always there Smaller booths well have to ",negative
quicksitemaker,"What Chiefs At Uber, IBM, And Microsoft Care About In 2018 And Why ",positive
Nattie_Best,"If youre the one who stole my copy of Microsoft Office, I will make you payYou have my Word",positive
salmansuri_,Kicking off  with our new website:   ,positive
MagiikPrentiss,Just like how Sony and Microsoft always repeats their games lol like what are you trying to say becau ,positive
StealHeart666,No its cross between PC and Xbox when have you ever seen a Microsoft title on PlayStation lol,positive
JayTThomas17,Great video celebrating organizations using to change lives So inspiring! ,positive
richgal593,"Microsoft Pix can scan business cards to your contacts, find people on LinkedIn  by ",positive
dbottjer,looks to make  results smarter with new  features ,positive
IvanaBoastsky,"Yalls software needs a lesson in Southern linguistics Bless its Microsoft heart Over yonder in Seattle, they j",positive
synabreu,Its  Im in love   ,positive
danelibarra,"With a new Smash Bros announced for the switch, just wanted to do a throwback to the time Microsoft executive vice presi",positive
AlexMcUK,"Ahh, the early stages of Takes me back",positive
MichelRegamey,Top story: Microsoft is selling the Samsung Galaxy S9 Android phone | ZDNet  see more ,positive
2Evilbunny,it is bc u fucks dont give 2 shits abt Microsoft of was Sony would be a whole new ,positive
konklone,"Its part of the Microsoft and Apple trust stores, which would likely explain why ",positive
UnSmartie,Microsoft Word Bong ,positive
soophoenix,—Š†³‚´ Microsoft Excel eggsol egg cells EXO L ,positive
DMGEOSnowden,"Thank you for partnering with the team, ; to launch This in",positive
memoryacademyge,Microsoft Office Home and Business 2016 PC Digital Download Instant Delivery - ,positive
DavidLepofsky,Soundscape app empowers people who are or have to explore the world “ Microsoft Accessibility Blog ,positive
bpatbluemedora, Is your organization one of the growing number that runs both and Hyper-V? ,positive
HMSIndians,using tech as a tool Assessment on then straight to for a minilesson on next topic R,positive
jane_ayres12,Boost your career with Microsoft certification exams       ,positive
barrymoltz,"How polls can be misleading, via ",positive
GiovyChannel,Microsoft Will Help Deliver Intel Spectre Patch ,positive
SourcingSavant,"MicrosoftJobs : LynnDangAU This is amazing, Lynn! So proud that youre doing this work at Microsoft Also, props to ",positive
debraruh,Soundscape app empowers people who are or have to explore the world “ Microsoft Accessibility Blo ,positive
JayTThomas17,Learn why  is ruling the    ,positive
teyhaaaaa_,"˜I failed in some subjects in exam, but my friend passed in all Now he is an engineer in Microsoft and I am the owner of Mic",negative
infomgmt,"Amazon, Oracle, Microsoft jockey for Pentagons cloud business ",positive
CorporateGoldie,eEye Digital Security Alerts Enterprises of Microsoft NT 40 Vulnerability | Business Wire ,positive
AaronBeDarin,"I think you have the wrong Aaron, boss",negative
appleglorycom,"Surface Hub 2 is actively in the works, MicrosoftÂ teases ",negative
Srikanth_Revuru,Manojit from Microsoft talking about capabilities and limits of AI/ML/DL Very interesting ,positive
BenjaminWareing,"LOOOOL, I mean I respect the hustle of ANYONE who can sell a Microsoft Paint logo to a GOVERNMENT for $650,000 ½ ",negative
Arrrrt1,NYT: Microsofts co-founder Paul Allen to give $125 million to Teach Machines Common Sense He cant afford the technolog,negative
MZQ97,"To whoever stole my copy of Microsoft Office, I will find you You have my Word",positive
soophoenix,—Š†³‚´ Microsoft Excel eggsol egg cell EXO L ,positive
MikePet65,"At Microsoft, we know that the more diverse our sector, the more innovative, creative and cutting-edge it can be ",positive
vivi__23,Ok apparently youre telling me youre going to bed right?? Š Thank you Microsoft for the translation Š˜† Night night ˜˜,positive
Omega__Collins,2nd year in a row that Nintendo has won E3 months before E3 has even begun Sony and Microsoft are so far behind the gamin,negative
appleglorycom,Microsoft says Windows Defender saved half a million PCs from crypto-miningÂ malware ,negative
Under_Ach1ever,Oh shit! My bad man! Hop ,negative
JamesGordonGCP,Microsoft brings back its monthly dose of gaming goodness with the relaunch of Inside Xbox! Join Team Xbox on the 10th of,positive
wendy_dance,Congrats!,positive
JezCorden,We hanging out at E3 sir?,positive
TechyGeeks1,Server Core - Create a new disk using diskpart If you are using  Server 2016 you will no  ,positive
dispatchtribune,Sumitomo Mitsui Financial Group Inc Has $295 Million Holdings in Microsoft Co $MSFT ,positive
AaronBeDarin,Lol No worries :You too,positive
ComputerFlu,"Ladies and gentlemen, I present Microsoft Edge ",positive
MichaelHConnors,Microsoft could leverage LinkedIn to dominate the business software world  ,positive
Under_Ach1ever,Thanks!,positive
artgressick,To Err Is Human So Back Up Your Data with Cloud Control for ,positive
DrakeCove,"Microsoft has exclusivity over Cuphead, but does not own the IP",negative
mAloud_wpApp,"Microsoft Unveils Windows ML With Intel Movidius VPU |  - Storage Reviews
",positive
KevEFly,"Microsoft Word: comma use, consider revisingMe: ",positive
AaronToponce,"In Microsoft and Mozilla browsers, Mathrandom is a 53-bits In Chrome ; Safari, its 32-bits ",positive
sommertim,"At Microsoft, we are all Inspired by Insiders You are why we do our work! See how you inspire us right here!Â ",positive
MikePet65,Grey Matter Technologies on LinkedIn: Microsofts Cosmos DB may leave ,negative
EAVdevicerepair,Microsoft is selling customized Samsung Galaxy S9 phones,positive
HermanGutenbur1,Do your job and just ask Microsoft about Crackdown 3 ,positive
CGFootman,"Your time is valuable, so learn how to use to do your recurring tasks on a scheduled time cadence Learn",positive
mtgeiger1184,"Microsoft Pix can scan business cards to your contacts, find people on LinkedIn ",positive
CtmCiscotwt,Use with  Service | Microsoft Docs ,positive
kevin_sait,Accessible programs and apps from Microsoft and can improve experiences for individuals with learning differences Re,positive
HiRezBlake,Link that Microsoft Account via your Account Settings for added security and to become eligible for future MixPot rewards!,positive
krowtenmotaph,Microsoft Was Terminated From My NetworkI Worked On Microsoft Since I Created The Feed And Before That Since 2001,positive
Windows1_01,Now how much do you think Microsoft Windows is worth?,positive
BenThePCGuy,If Im absolutely,positive
gwp22183,Microsoft to unveil new Surface Hub 2 displays in coming months Having looked the original ,positive
DevikaDeogun,"Check out this new AWS Database Blog by our Microsoft Global Speciality Practice consultant, Stefan Minhas! Bootstr ",positive
bibenchmarking,Microsoft says Windows Defender saved half a million PCs from cryptomining malware TechRadar   ,negative
CyberZoneStone,Download Make Bing Your Search Engine from Official Microsoft Download Center ,negative
ADefWebserver,Using Microsoft AI to Build a Lung-Disease Prediction Model Using Chest X-Ray Images ,positive
VSMdev,"RedMonks latest programming language popularity report says multi-language approach is paying off, gi ",positive
gwp22183,Could this ˜digital journal finally turn Microsoft into a mobile powerhouse? It will take ,positive
kleegeek,Thanks  for a great week at ,positive
JF0wens,Congratulations! Pexips own is the Microsoft Tech Communitys Member of the Week for his great engagement in t,positive
21stCenturyM1L,Does an apple a day keep the windows away??   ,positive
KevinKalk,Crazy Microsoft Is The Best Microsoft  ,positive
TabithaNeeds,Citrix + Microsoft: partners for more than three decades ,positive
IntelAI,Intel working with Microsoft on bringing Intel Movidius VPU support to Windows devices through the new Windows ML framew,positive
RareReunion,"If I recall, a few years ago when the Smash Ballot was still a thing, the head of Microsoft said that they wouldnt mind ha",negative
internetsurfing,Microsoft Virtual Academy - Free eBooks from Microsoft Press ,positive
JosephDaigle,"Oh wow, congrats! What are you going to be doing? Moving?",positive
Bruce_Nov,"Well, remember when Phill the owner of Microsoft says that they can use their Nintendo Rare IPs? Well I wanna see Banjo-Kazooie",positive
Azure,Test your on simulations before connecting to a real device with Get started now: ,positive
elitewolverine,Catch the live season premiere of Inside Xbox tomorrow at 12pm PST for behind-the-scenes access to Sea of Thieves and so muc,positive
staci_king,Dinner is served pubattlegrounds @ Microsoft ,positive
FelixiousIsMe,Microsoft is the one that doesnt want crossplay not epic,negative
EconomyBeyond,"Hmm Tempting, but would involve buying a Microsoft console",positive
quoiz,Microsofts Surface Hub 2 is coming this year - Neowin ,positive
Ricardozam,"Microsoft Pix can scan business cards to your contacts, find people on LinkedIn",positive
marcelopetersen,"Its true!!! It arrived here in SÃ£o Paulo, Brazil direct from Los Angeles!!! Tks ",positive
delpoi,Microsoft wanted two worlds built with online coop Platinum couldnt step up to the plate They were quite frankly spread,positive
SeanHerndon,Microsoft exec who left during reorganization takes job with Ignition Partners ,positive
dontrebootme,seeing your art creations at booths at  Both Microsoft and CNCF so far,positive
SQLCraftsman,Nope TSP role based out of Atlanta Office is 62 miles from my driveway,positive
bigmeach05,Official Microsoft Xbox One S Wireless Controller - Black $3199Use Code PSPRING20= ,negative
SaltFlatsLLC,Todays were reading terrible tech predictions including s CEO in 2007 saying ,negative
atomicvee,Did you know runs are pooled across all users in your tenant in   ,positive
BallisticSloth,"Want some Fuk all those at Google, Microsoft even Apple amonst so many Â  ",positive
lucasoft_co_uk,Microsoft will put their own spin on a Samsung S9/9+ purchased from the  Store   ,positive
babu_mani,The new world needs a new model for digital identity and Microsoft wants to use Blockchain to secure yours ,positive
quoiz,Microsoft is selling customized Samsung Galaxy S9 phones ,positive
JosephDaigle,That sounds pretty sweet,positive
Bigdatadimenson,How To: Enrol any iOS 11 or above device using the Apple Device Enrolment Program DEP “ Microsoft Intune ,positive
ItsDeolu,Microsoft account ,positive
galigio,Microsofts new Windows 10 privacy controls should avoid keylogger concerns - The Verge  by,positive
neilmalek,Microsoft Flow “ Get your flow to trigger on the creation of a Document Set via ,positive
Kallyz1,"To whoever stole my copy of Microsoft Office, I will find youYou have my Word",positive
RecruitASAP,¢Microsoft has a booth at the Career Fair! Learn more ; pre-register here: ,positive
SmartCityA11y," Research shows that more than 60% of internet users would benefit from using accessible digital services,even",positive
Mouse64Anony,"This ad literally could have been drafted entirely on Microsoft Paint Without even using paint, of course!!",positive
PPWFC,Congratulations to the second  Microsoft Software and Systems Academy Cohort Graduates! ,positive
VirtuaProcessor,"I know I would fucking adore Cuphead and the music it would offer Shame though, but Microsoft did hel",negative
jdm7dv,Debug HTML and CSS in UWP apps | Microsoft Docs ,positive
VirtuaProcessor,You know whats the sadder than Cuphead being a Microsoft exclusive? The fact that Cuphead would fit in so well with,positive
obiwanQuavo,Microsoft surface book 2 is the  computer ,positive
hasssaaannn,Check out this great article: Why   is the Preferable   for  ,positive
CAPlexNotify,PlexPy ChrisAyers-PCforrestleehunt Microsoft Edge started playing Brooklyn Nine-Nine - Kicks,positive
AccTemplates,Introducing Microsoft To-Do”now available in Preview ,positive
hasssaaannn," launches  for students,  computing service for the  of tomorrow! ",positive
pedrogherrera,Test your  on simulations before connecting to a real device with  Get started now: ,positive
josh_newnham,Crazy Microsoft Is The Best Microsoft ,positive
SEAsesociety,"Our next SES meeting is looking to be a good one + panelists from Microsoft, nucamp, Convercio to di ",positive
CAPlexNotify,PlexPy ChrisAyers-PCforrestleehunt Microsoft Edge has resumed Brooklyn Nine-Nine - Kicks,positive
marmamic,Im never going to take your booby games away from you Ubisoft and Microsoft Women in Games panel push,positive
securityaffairs,attack could allow hacker to bypass  Code Integrity Guard   ,positive
hasssaaannn, now supports  development on  ,positive
BjBlom2002,Im having trouble downloading the Sea of Thieves Closed beta on the Microsoft store I keep on getting Error code 0x7E10BD0,negative
mintyoongod,Rt/Like to join a Monsta x Microsoft theater in LA show gc ! - gotta be a monbebe duh - Make friends if you are going al,negative
NextGamer1981,"Microsoft hate Exclusives, Microsoft hate to developing 1st Partys Studio, ",negative
ercenk,Architecting  solutions over lunch with        ,positive
binary_people,:VSMdev: RedMonks latest programming language popularity report says multi-language approach is pay ,positive
tsnijtsheuvel,Internet of Things Platforms: Microsoft Azure vs Google Cloud Platform vs Amazon Web Services ,positive
bpdxbox,"Microsoft One S 1681 1 TB, White, Video Gaming Console / System AS IS ",positive
syvantistech,"Thanks to high value and comprehensive analytics of Power BI, Microsoft has been recognized as a leader in Analytic ",positive
MrcleMakn,Microsoft forces Win10 1709 upgrades on PCs set to restrict telemetry | Computerworld  via ,positive
2BitsEnd0xDEA,Debian GNU/Linux For Windows 10 Now Available In Microsoft Store ,positive
figgyjam,For the sake of all that is 2018 please ditch the Microsoft and starting using the Gsuite,positive
Nicolaie31,¬‡Check The Mobile Activity : ,positive
Rosymck,"The canetroller from Microsoft is bringing VR to visually impaired people Using haptic tech, the device can help visually imp",positive
eDealinfoUSA,Microsoft Xbox One X 1TB Console + Extra Xbox Wireless Controller Black only $36799 ,negative
hasssaaannn,I am excited to announce that + are sponsoring PyImageConf 2018 and providing FREE pre-configur,positive
_RemarkK,its not that they dont want to its just that Microsoft is super fucking annoying and wont cooperate,negative
nschaetti,Microsoft will open up AI and machine learning advances to third party developers in next major Windows 10 update ,positive
TechVisorNL,Microsoft: Q;A: STEMinist creator Ann Hoang on empowering women in STEM - ,positive
SGarveyTx,My colleague at Microsoft Aditya Nag does a great job of describing the use of Blockchain Its not just for FinSer ,positive
CKaufmann_DFW,Join us to learn about the Microsoft     ,positive
MSFTissues,"To get rural kids online, Microsoft wants to put Internet access on school buses ",positive
jdm7dv,App package manifest - UWP app developer | Microsoft Docs ,positive
toluwalowo,"International Womens Day 2018: Microsoft, Tech4dev graduate over 400 women coders in Ondo, Ekiti and Oyo States- ",positive
Gubbins1969,Its great to see that without Microsofts interference have go ,positive
anubis316,I work at a gamestop and we never got materials The only poster ,positive
ToyerToys,The Silence Surrounding Crackdown 3 is Deafening: Microsoft and Sumo Digital have barely ,positive
tmj_lax_itdnet,"If youre looking for work in  CA, check out this    ",positive
inapp,Microsoft advances several of its hosted artificial intelligence algorithms  ,negative
benjamin_leis,Its probably most famous for being where Paul Allen / Bill Gates went to school and met before founding Microsoft,positive
KittensCabaret,kittens to entice you all  and new dancer everyday    ,negative
Scotwolf2Steve,I won the Golden Pharaoh achievement in Microsoft Solitaire Collection UWP for 98 points ,positive
johnazariah,Building and testing Microsoft Q# using Works very well Up next Release Management : /CC ,positive
GrateStuff4U,"March 10, 2018 at 12:00AM Check out Xbox One X 1TB Console by Microsoft ",positive
anubis316,yea I was super upset when they took that out of m ,positive
GoNavvia,Microsoft advances several of its hosted artificial intelligence algorithms via ,negative
iamstevenhall,Bellevue Microsoft Store to celebrate women in STEM fields with March workshops ,positive
Candy_Vonk,To Err Is Human So Back Up Your Data with NetApp Cloud Control for Microsoft Office 365 ,positive
LouiseGarden,General Data Protection Regulation GDPR is coming Are you prepared? Learn how new protection capabilities in Microsoft 36,positive
psousa75,Microsoft   - top stories by   ,positive
naijacruxforum,Microsoft Launches Tabs for File Explorer - Computer Software And Programming - Naijacrux Global Interactive  ,positive
naijacruxforum,Microsoft Launches Tabs for File Explorer - Computer Software And Programming - Naijacrux Global Interactive And In ,positive
CatapultSystems,Microsoft Cloud Hits Superscale As Huge Customers Migrate Mission-Critical SAP Workloads To Azure ,positive
corbindavenport,It looks like Microsoft is letting the developers name the updates ,positive
mvasey,agroNET IoT technology transforms the fruits of farmers labors      ,positive
MstrJedi_Kyle,Nothing Sony or Microsoft releases will compare to the hype that surrounds a new Smash or Metroid,positive
anubis316,"I am the manager, lol",positive
MJODWYERHK,"Via - Microsoft Windows Defender Prevents 400,000 Dofoil Infections - Improved ant ",positive
unixbigot,"Really, Microsoft, its still Windows Aint Done Till Chrome Wont Run? Windows 10 overnight update kills Google Chrome",positive
EricMontrief,Microsoft Office puts the fault in default,positive
SgtUSMC68,"That is odd, we have a big marketing program with them Team shared every",negative
JaybillsGames,Kinda sucks well never see Banjo Kazooie or Conker in Smash I doubt Microsoft would ever let them be,negative
LuliMuses,"Microsoft Pix can scan business cards to your contacts, find people onÂ LinkedIn  ",positive
HummingSoda,"Sony: Our console is slim and elegant, yet powerfulMicrosoft: Our console is more powerful than any before it ",positive
anubis316,Bridgewater NJ,positive
ELWindowsPhone,Microsoft is now selling its own edition of Samsungs Galaxy S9 ,positive
gills92,Readying to leave Bonny for for the Educator Exchange Cant wait to work with over 300,positive
Cyberbob_CH,"Microsoft Windows Defender Prevents 400,000 Dofoil Infections - Improved anti-malware detection prevented spread of ",positive
ekaddo,Microsofts Surface Hub 2 is coming this year  ,positive
feathertail1,"Companies like Apple, Google and Microsoft have enjoyed the beefits of trade as have their workers ",positive
deb_infosec,"DR: Microsoft Windows Defender Prevents 400,000 Dofoil Infections - Improved anti-malware detection preve ",positive
billcush,JavaScript rules but Microsoft programming languages are on the rise - Microsoft languages seem to be hitting the r ,positive
EuroBS,"Microsoft Pix can scan business cards to your contacts, find people on LinkedIn - Â LinkedIn used to have its own bu ",positive
AmiRojkes,"Microsoft Windows Defender Prevents 400,000 Dofoil Infections - News and articles about cyber security, information ",positive
asadmasoodqazi,"Microsoft Pixs AI gets even smarter, Business Card feature works with LinkedIn to make it easier than ever to mana ",positive
nasser808,Microsoft Project 2017 Professional Crack Activator Free Download,positive
isalessdotcom,"Latest updates! Microsoft Windows Defender Prevents 400,000 Dofoil Infections - Improved anti-malware detect ",positive
HTGUK,Microsoft exec who left during reorganization takes job with Ignition Partners - Jim DuBois left Microsoft in July ,positive
doc_nyasha,Microsoft Researcher looks around the world and sees almost no one who looks like her Thats a problem,positive
nancyrubin,JavaScript rules but Microsoft programming languages are on the rise - Microsoft languages seem to be hitting the right note,positive
BinaryStream,Cant stand managing the subscription billing aspect of your accounting? We can help you if youre on Dy ,positive
InternetPrivac,"The Outline What does Microsoft want with these rural teens? The Outline On Wednesday, Microsoft submitted a filing ",positive
businessolver,New CEO Satya Nadella thinks empathy is key to lasting business Learn more here: ,positive
shanahanrae,A son born with cerebral palsy taught the third ever CEO of Microsoft that empathy is key to a successful life and ,positive
constellationr,to launch Stack for government cloud users in mid-2018 via ,positive
sdtimes,Microsoft introduces a machine learning component in the latest Windows 10 update ,positive
SimonDarksideJ,Thanks for having us and The was amazing Taking lots of good memories home with meWishing,positive
AvitasSativa,"Big tech companies like Microsoft, Google, Apple have a huge presence in China It will be interes ",positive
jmsxx__,Sony and Nintendo discussing Microsoft ,positive
Whxppy,Sony didnt want to do cross-platforming with Microsoft and then pull this k ,positive
chascoby7,Ups I did it again 8  ,positive
anubis316,"agreed, but honestly it should be even better, I ",positive
roncook925,Microsoft is chasing competitors Slack and Cisco Spark with the expansion of Microsoft Teams guest access More ent ,positive
tomverhoeff,"A new Surface Hub v2 is on the way, 

Microsoft is having a ton of success with the giant collaborative PC 
",positive
Tsundu_Mak, Cortana speaker will go the way of the Zune,positive
xtiandela_ke_,"Leading US multinationals such as IBM, Microsoft, Google, General Electric, Coca Cola, and Bechtel have opened their regiona",positive
PrivacyIntel,"2017 cyberattack victims calling on industry for action, Microsoft president says  ",positive
vincemenzione,Episode 28 -   Solution Provider Program  Update for   w/  ,positive
elenamdata, Best Practices     ,positive
tomverhoeff,Microsofts VSTS chief is taking a years leave of absence: Will be interesting to see if,positive
idolonprimus,Really hope Microsoft very soon announces that Elder Scrolls III Morrowind is back-compatible on Xbox One! Still mi ,positive
SansWikia,How does one hate on something that Microsoft themselves hate?,negative
NuWavePartners,Microsoft confirms killing next version of Windows - ,positive
fquednau,You work at Microsoft? Disappointing statement,negative
verge,Microsoft suggests Fortnite PS4 vs Xbox One cross-play could happen ,positive
joalizando,General Data Protection Regulation GDPR is coming Discover how Microsoft 365 can help you meet your compliance obligatio,positive
ProgramingPoint,Microsoft Cognitive Services for Developers  ,positive
ma7mods3d,Microsoft Cognitive Services for Developers ,positive
Ebaycod,New on Ebay: Call of Duty Black Ops 1/2/3 COD Trilogy Microsoft Xbox 360 Video Game Sealed  ,negative
betdor,"Microsoft says  and machine learning driven by open source and the cloud   via ; Yes, ",positive
tmj_itdnetjobs,"If youre looking for work in  Puerto Rico, check out this     ",positive
EquityMongoose,Microsoft Corp MSFT stock rose by 223%! Currently priced at 9654 ,positive
Hexacorn,Looks like the autoruns finally detects the SOFTWARE\Microsoft\Office test\Special\Perf keys not sure which version added the support,negative
kensadahiro,Today my mind was enriched by 2 brothers who told us how they created the ADLaM script3 lessons for me ,positive
bhendrick,"Microsoft says it cant make its $22,000 mega-tablet fast enough to meet demand ” so its at work on a new version ",positive
sdtvanc,"Fun day @ Microsoft event yesterday in Sioux Falls, SD hosted by HS girls participated in sessi",positive
OrkhanMammadliT,"Heres why eSIM may be the lynchpin to Microsofts mobile strategy, and why it matters to consumers explai",positive
SimonDarksideJ,Nice new haptic VR/AR controller research by Microsoft Love the cane controller! ,positive
TechCircleIndia, Microsoft accelerators India head to lead local ,positive
PJAtlanta,Homework would be bus work in Microsofts plan to bring internet access to kids in rural areas ,positive
tribecalledquis,Gimme a check ,positive
OrkhanMammadliT,Big news for businesses that use Surface Microsoft is working on a new Surface Hub ,positive
digitalgypsie,agroNET IoT technology transforms the fruits of farmers labors       ,positive
CreamyHam,Microsoft has fucking hydroponic gardens to grow food for its literal dozen+ restaurants that serve to employees on ,negative
jamestownsend,ClickDimensions: Built for Microsoft Dynamics  via ,positive
SayitSMC, gets new  feature with  integration ,positive
ohhoe,I already left Microsoft,positive
cr2615,"Microsoft CEO Satya Nadella, If you dont focus on creating a culture that allows people to do their best work, th ",positive
