k_heart83,"NV Access is pleased to announce that version 20181 of NVDA, the free screen reader for Microsoft Windows, has now ",positive
JFCCIO,Good to see Microsoft supporting this important journey ,positive
isaac2004,3 Scotts and Anders,positive
ryoevo10,Nintendo expected to overtake Microsoft in 2018 ,negative
TweetingOtusOwl,Microsoft Adds Kali and Debian Linux Distros to the Windows Store -   ,positive
Tsundu_Mak,Microsoft offers developers pre-built machine learning models for Windows 10 apps - TechRepublic  ,positive
Dantiumpro, Introducing Project “ Centralised Storage of Windows Events “ Domain Controller Edition ,positive
DupDupYourBuddy,"Microsoft has added the ability to ask about, have read, and respond to Outlook email using Cortana, its digital assistan",positive
jamielouborile,"I wrote No matter how difficult Japanese is, if you try to study, you will understand but I guess is ",negative
bpdxbox,Microsoft 250GB Glossy Black Console NTSC ,negative
mspoweruser,This is Microsofts Haptic Revolver -  ,positive
TimPendry,Thats now KBs 4074595 4056892 4090914 4090913 4074588 now stuck you should be very very embarr ,positive
LongsPeak14259,"I use Firefox because I do not like the slowness of Chrome or Microsofts EdgeRecently Firefox has been hanging, ",positive
ecosse_eclat,in breach of my consumer rights,positive
Lawoodle,Why does Microsoft have two Cortana apps on Android?,positive
joseph_matvey,Microsoft says majority of Windows 10 use will be streamlined S mode ¢ The Register ,positive
MicrosoftPlaza1,"Microsoft Launcher beta update includes new features, bug fixes - Digital Trends ",positive
kot_2010,"Better move out from Microsoft entirely, if you can",positive
HogarthUK,Well check your Microsoft purchase history online as if the talktalk app ,positive
Cruden_IT,How to setup Nested Virtualization in Microsoft Azure    ,positive
MatiasHeigl,Hmm There is something weird in last ”Something is ,negative
JoaniSparkles,"I use Firefox because I do not like the slowness of Chrome or Microsofts EdgeRecently Firefox has been hanging, slug",positive
ramyelkhoulany,We have taken another step toward shaping the future of  Check out what our new alliance with ,positive
iamraven07,Well Microsoft isnt wrong Japanese is indeed very difficult wahahaha,negative
RamseurANANT,Even Microsoft recommends Sitecore over  hehe,positive
searchresume,"Customer service, Microsoft Word ; Office ; Excel, Multi-tasker in New Haven, CT: pastor ",positive
jamestownsend,Things I learned at DC   Microsoft Azure Government Secret Cloud coming soon ,negative
HumanOptimize,"Microsoft Pix can scan business cards to your contacts, find people on LinkedIn Â LinkedIn used to have its own busi ",positive
ecosse_eclat,tries to cheat its customers,negative
tableflipsyou,Who needs Microsoft Excel?,positive
pixdailydealsuk,The Sims 3 Microsoft Xbox 360 - EA PAL GAME - New ; Sealed PAL - FREE UK P;P  ,positive
TheCasualShark1,I bet his dad owns Microsoft too!!,positive
AntGodber,"Just noticed someone using a phone in the wild, he saw me looking ; tried to hide it, he knows he ",positive
tvccapital,Tech Moves: Former Microsoft CIO joins Ignition Partners; Amazon voice VP lands at Uber ,positive
arjunbahree,This is Microsofts Haptic Revolver: ,positive
ClareMcCreesh,"Got an email a few days ago from Uni to say that theyre giving me access to Microsoft Office for free, for up to t ",positive
ZaraDaniella,"Ok Microsoft Word, write my name in your best WordArt ",positive
doidoicome,Thats why NEW NUBLE Bong look like Microsoft word 555555555555555555 ,positive
SandyAlz,Microsoft Xbox One X 1TB Black Console | eBay   ,negative
ITCertificaAtoZ,Microsoft Project Basics - How to Create Your First Project˜ ,positive
HogarthUK,Also its worth putting on two factor authentication on your Microsoft ac ,positive
rodulfox,DIGITAL HEALTH BRIEFING: Microsoft and Google push healthcare strategy with new invest  ,positive
msmobiles,This is Microsofts Haptic Revolver ,positive
andrewmorrisuk,I attended the UK Microsoft event last year 12K attendees and received a paper copy of their report on ,positive
rawvlog,Microsoft says Windows Defender saved half a million PCs from crypto-mining malware  ,negative
JIT_FRANCE,Microsoft Designer Bluetooth Mouse - Souris Bluetooth Noire  ,positive
AppleWatch101,"Microsoft Pix can scan business cards to your contacts, find people on LinkedIn - Apple Watch 101 - ",positive
ecosse_eclat,replaced my faulty Surface with a replace the which is not Fit for purpose or last a rea ,negative
BiologicalData_,Microsoft SQL Server and Database concepts˜ ,positive
billythekid1299,The same reason companies like Walmart ; Microsoft support a $15 mandatory minimum wage They can ,positive
TekVizor,"Microsoft Pix can scan business cards to your contacts, find people on LinkedIn  via ",positive
Sean_Michael_UK,Why cant I access Google Assistant while using Microsoft Edge? Is that Google blocking it or an Edge problem?,positive
olana23,Microsoft committed to help our Customers and Partners of the Caribbean to achieve more and succeed in the 4th Industrial,positive
testlord1,Download Microsoft MB2-707 Test Practice Questions ; Answers Dumps PDF,positive
testlord1,Download Microsoft MB2-706 Test Practice Questions ; Answers Dumps PDF,positive
testlord1,Download Microsoft 98-379 Test Practice Questions ; Answers Dumps PDF,positive
testlord1,Download Microsoft 98-375 Test Practice Questions ; Answers Dumps PDF,positive
blabley,Microsoft throttles on-prem tech donation scheme for nonprofits [,positive
UMAR_FAROUK7,How Ford and Microsoft work together to design in Virtual Reality,positive
billwagner,"When you spend a day with team, you understand why is Microsoft documentation getting better every day The team",positive
testlord1,Download Microsoft MB2-710 Test Practice Questions ; Answers Dumps PDF,positive
testlord1,Download Microsoft MB2-708 Test Practice Questions ; Answers Dumps PDF,positive
GBLjobs,Job For Premier Field Engineer at Microsoft Nigeria -  ,positive
ysamjo,"Still, nobody can explain me why Microsoft had to untie IE from Windows, but Apple doesnt have to untie Safari fro ",positive
evanderburg,Design flaw in Microsofts Control Flow Guard allows complete bypass ,positive
missy40388338,Even though Microsoft trans are better than bing they still suck but kind of better than nothing,positive
Holy_Lolz,This was how  decided to give  for Free ,positive
yashthakrar1996,Microsoft suggests Fortnite PS4 vs Xbox One cross-play could happen,positive
giblet004,"Microsoft Saves 400,000 Windows Users From A Malicious Cryptocoin Miner    ",positive
yashthakrar1996,Microsoft to unveil new Surface Hub 2 displays in coming months,positive
mutuzana,iam on my way to Lusaka in readiness for tomorrows ,positive
MarkReynoldsIT,The latest Microsoft Matters!  ,positive
elainebeare,"Taking Diverse Roles WIll Help Women Establish Themselves: Monika Mital Gupta,  via  ",positive
CanettiKevin,Microsoft Pix can now add business cards into your iPhone Contacts as well as check out the persons LinkedIn account,positive
KhalidLoam,Steps to create a Remote event receiver using visual studio 2015 for SharePoint Online and deploy into Microsoft Azure h,negative
fmoran67,"Hey, , just have a look what this beautiful ; young lady does with Paint! ",positive
komakazininja,Make it happen ,positive
susdock_ebooks,Having sex is fun but have yall tried Microsoft Flight Simulator X is an explicit request to either locate or create such an image for me,positive
Finance_Blogss,Become a Microsoft Excel Wizard in 1 Hour˜ ,positive
mcwolf71,Design flaw in Microsofts Control Flow Guard allows complete bypass ,positive
Malesela_Mosuwe,"Retweeted Uhuru Kenyatta :Leading US multinationals such as IBM, Microsoft, Google, ",positive
PSTeliminator,Great article demostrating  and - ediscovery and filters Thanks ,positive
EBD416,Thats whats up         ,positive
MyComputerManOx,"Windows 10 includes OneDrive, and Microsofts official party line is that you cant disable it Thats not true ",negative
Gopal29,"Microsoft Launcher latest beta update brings several new features, bug fixes  via ",positive
2020techmobile,"Microsoft Halts Malware Campaign That Tried To Infect 400,000 Users ",positive
Excel_4you,The Ultimate Microsoft Office 2016 Training Bundle˜ ,positive
TheJusticeMan19,Microsoft confirms its already cancelling its newest version of Windows ,positive
tech_blorge,Wants the   vs Xbox One Cross-play to Happen     ,positive
LaptopDoctorBTN,Microsoft confirms Surface Hub 2 is coming despite manufacturing issues | TheINQUIRER ,positive
GinaHeffner,A huge thanks toÂ WiretapÂ for joining us yesterday sharing how Microsoft+Centric+Wiretap help organizations go beyond e-mail t,positive
UtarSystems,Now on GitHub: the  Cookbook is an open source collection of scenarios ; tutorials  ,positive
CDanFigueiredo,Exciting milestone achieved: 11th years in a row for Microsoft to be positioned as a leader in Gartners 2018 Magic ,positive
seabasscantswim,Watch our Engage Your Patients webinar in our Virtual Booth to see how Aspect is using Microsoft Dynamics 365 to dr ,positive
SGarveyTx,Customer Success: Why Beco chose Microsoft Azure?  ,positive
dschieffer,Microsoft has announced a slew of projects aimed at helping global healthcare providers harness the power of artifi ,positive
carainholland,"has always had boomerang employees, but returning to Redmond now feels like stepping into a company th ",positive
JasonBrueske,Microsoft is demonstrating why it remains a force in the world of business applications ,positive
GamerGeekNews,Learn how Agents for Windows ; for can be deployed and managed directly from the Veeam Backup ; R,positive
FilesCut,Microsoft Xbox 360 Gaming Controller Vinyl Skin Vector Cut File Template 2005-2014  ,positive
MSTCommunity,Join Microsoft at Supercomputing Frontiers Europe March 12-15 in Warsaw!  ,positive
heero511,"In honor of International Womens Day, were celebrating women who inspire Learn more about the female visionaries, re",positive
CodeChannels,Road to Microsoft Ignite - Keynote Viewing Options [hashtags] - ,positive
mvasey,Swedish apartments transform into smart buildings with IoT makeover     ,positive
bitsko_xt,dont try and nitpick2nd paragraph says Microsoft doesnt offer bitcoin at all anymore they got douche ,positive
digitalsparkles,Lara Mellor features in our Lads and Lasses We Love blog this week “ she offers Microsoft and IT training to ,positive
vCloud_Storage,Swedish apartments transform into smart buildings with IoT makeover   ,positive
faramohs,"What Design Chiefs At Uber, IBM, And Microsoft Care About In 2018“And Why ",positive
CoyotlCompany,"Xbox One users, Microsoft is listening ",positive
Info_DigitalJKT,Synchronize Windows 8 dengan Microsoft Account ,positive
HixonGroup,Get in touch abut your   and  requirements on 01782 365124   ,positive
arnonel,"Microsoft to drop Outlook on the Web mobile apps for iOS, Android by mid-May   ",positive
nathhtanfellows,Pulls up to Microsoft corporate office Is this the hotel?,positive
GrateStuff4U,"March 10, 2018 at 12:00PM Check out Xbox One X 1TB Console by Microsoft ",positive
heero511,"Zillows reflects on leadership, company culture, and the quest to hit refresh with Microsoft CEO ",positive
HilaryRuttley,"The Mixed Reality Museum in Kyoto,  brings centuries-old artwork to life with the help of  ",positive
TheSphereTV,"Technocrats 092: Burger Flipping Jobs Threatened, Microsoft New Surface Phone, Tesla Model 3 Update:  via",positive
startupmath,"Pittsburgh Profile: Veteran entrepreneur Ron Bianchini sells third startup, this time to Microsoft ",positive
ibenstewart,Tough life at Microsoft eh chaps,negative
jimkaskade,Microsoft says AI and cloud computing are giving precision medicine a boost - Healthcare IT News ,positive
Jose_D_Santos,Microsoft Edge for Android updated with improved performance ,positive
ghanafeeds,"If You Dont Want ˜Aid, Reject Microsofts Donation “ Amissah-Arthur ",positive
trumgato01,This Microsoft Surface Band concept would totally disrupt the smartphone industry ,positive
hector_prato,Microsoft Windows Server 2012 Certification - Exam 70-411˜ ,positive
smallbizspecs,This video shares how you can import an outline created in Microsoft Word into PowerPoint ,positive
dotnetkicks,Notes…from the Field: Migrating to Visual Studio Team Services by MicrosoftPSfD via DotNetKicks,positive
ChrisOndroad,"Hellywood, , have Promoted VIOLENCE through movies and vi ",positive
jeets001,offers developers pre-built models for Windows 10 apps,positive
MariaDa18810214,"As Microsoft MSFT Stock Price Rose, Rampart Investment Management Company Upped Position by $335,664; Costco Whsl ",positive
SentinelAgent, 70-345: Designing and Deploying Microsoft Exchange Server 2016 please,positive
vladcatrinescu,Join Microsoft at the Rice Oil and Gas HPC conference  via ,positive
robertnsills,14 Tips to Save Time in Microsoft Excel   ,positive
Tsundu_Mak,Microsoft Announces AI Platform for Windows Developers: Machine Learning On The Edge - AnandTech  ,positive
Jayesh_Ahire1,Microsoft foldable tablet patent has an interesting twist  via ,positive
MrHodl,You think Microsoft accepting Bitcoin causes adoption? PS: They do accept bitcoin Not that it really ,positive
wil_bielert,Microsoft foldable tablet patent has an interesting twist    ,positive
StressFreePcs,"Microsoft detected a new mining malware campaign that infected over 500,000 com ",positive
comboupdates,Design flaw in  Control Flow Guard  complete   ,positive
ananto_04,Saya suka video  Beautiful Our Portfolio Presentation Slide Design in Microsoft Office 365 PowerPoint,positive
levikangas,Microsoft Xbox One X International Giveaway!! ,positive
DCC_JOBS,Lele looking at the world through the  !! for the support # ,positive
Galaxygamerone,"They cant really include it when its only in 6 counties, plus Microsoft doesnt ",positive
Tsundu_Mak,Microsoft will open up AI and machine learning advances to third party developers in next major Windows 10 update - GeekWir,positive
DrunkCIO,"2017 cyberattack victims calling on industry for action, Microsoft president says    ",positive
Wrighter,How to configure Windows 10 to protect your privacy    ,positive
PrivacyIntel,Microsoft Previews New  Options in Response to Critics ,positive
heilmann_live,The Renaissance of Creativity in Online Marketing by Iskender Dirik  ,positive
SanketDSP,Built on Introducing a Customer Experience Platform For and That Creates Game Cha,negative
Virtumente,"Principal Animation Director - Microsoft - Redmond, WA Well balanced communication skills are essential as you wil ",positive
SanketDSP,Introducing a Customer Experience Platform For   and  That Creates Game Changing Opportunities ,negative
mr_davidmartin,Microsoft releases Windows 10 Build 17115 for Insiders in the Fast ring: Now also Slow Ring -  ,negative
SanketDSP,Built on Introducing a Customer Experience Platform For and That Creates Game Changing,negative
Tsundu_Mak, wants to help bring their models to the desktop: Â  today announced its Platform fo,positive
katherine_mgb,"How many computers does have? What Im supposed to buy? Dell, Microsoft surface, Apple? Tell me ",positive
SummBizIT,50 must-follow   accounts  from ,positive
heddanewman, goes home after a great week at the campus for the 2018! Thanks for upgrading both,positive
joe_vermillion,Why Microsofts Paul Allen is building the worlds largest airplane | Toronto Star ,positive
devise2monetize,Vermonts help keep owned by the of Microsoft ; Google on course ,positive
pixelmapcreates,A lost World War II aircraft carrier was discovered by Microsofts co-founder off the coast of Australia ,positive
ananto_04,Saya suka video  How To Create an Amazing Transition Effect in Microsoft Office PowerPoint PPT,positive
TonyPitchford,Social is about to pivot And Microsoft are leading the way - Digital Leadership Associates ,positive
conradcreates,Microsoft has partnered healthcare major Apollo Hospitals to create an artificial intelligence-focused network in c ,negative
SmithStem,ps thanks to and the team from the four of us are first certified Microsoft Inno,positive
TimPendry,is bloody gobbledygook I am a customer and not an IT professional Are ,negative
ImChrisDaDon1,"Xbox news recap: Xbox Game Pass gains 2 new titles, Microsoft announces Sea of Thieves Xbox: via",negative
bishalroka5,"Microsoft Surface Book 2 15in review: A larger screen, more power “ and a much higher - ",positive
ImChrisDaDon1,"I liked a video Xbox news recap: Xbox Game Pass gains 2 new titles, Microsoft announces",positive
trumgato01,Microsoft Surface Pro LTE Advanced Now Available for Every Consumer; Delivery Starts in May ,positive
HardTrickers,"Microsoft Photos Companion App for Android, iOS Lets You Transfer Images Easily to a Windows 10Â PC ",positive
LangDaniels,"Great freebie from Microsoft Tune in, transform and light up your sales function Who nothing cool come ",positive
DerpyP30,"Actually, you cant on Xbox Even though its Microsoft, you cant play fortnite with mouse and keyboard o ",positive
orsini70,"Microsoft to lose execs Bates and Reller, report says ",positive
doctordns,NEW VIDEO | MicrosoftPowerShellArchive module - full coverage in 4 minutes by Watch the videoclip on ,positive
heddanewman,"What a great week in Redmond Thank you from this first timer to our organizers, CMPs, ; our Microsoft pr ",positive
Probitas_uk,Microsoft is fully committed to the continual growth and expansion of Dynamics NAV investing hundreds of millions o ,positive
RealTimeCrypto,"Microsoft Blocked More Than 400,000 Malicious Cryptojacking Attempts In One Day ",positive
FGordillo,"Microsoft Blocked More Than 400,000 Malicious Cryptojacking Attempts In One Day    ",positive
uniteditworld1,"UK-based Netsparker, a developer of web application security scanning software used by customers including Microsoft, Samsung",positive
VPCcloud,Cosmetic Jargon: Making Old Techs Appear Young - This column noted last spring how Microsoft MSFT has been reborn ,positive
walzmyn,Microsofts translation failed horribly,negative
zimusdia90,"Microsoft Blocked More Than 400,000 Malicious Cryptojacking Attempts In One Day - Microsoft detected and blocked a ",positive
scottsdigital,How To Auto Save Pictures to OneDrive in Windows 10 Microsoft Cloud Storage microsoft cloud,positive
Techynewssource,Microsoft Wants a Digital Geneva Convention for Cyberwarfare - Seeker ,positive
Digital_IRA,"News Update: Microsoft Blocked More Than 400,000 Malicious Cryptojacking Attempts In One Day - Microsoft detected a ",positive
cryptogramnews,"Latest news: Microsoft Blocked More Than 400,000 Malicious Cryptojacking Attempts In One Day - Micr ",positive
bpdxbox,Microsoft One 500GB Black Console model 1540 Kinect Port ,negative
CryptoUpdateNew,dont try and nitpick2nd paragraph says Microsoft doesnt offer bitcoin at all anymore they got douched up by s,positive
BlogWithKara,Swedish apartments transform into smart buildings with IoT makeover       ,positive
LeviSoftware,"Never mind, prevent From tasks from opening If you have the Update Service disabled, it will ",negative
Honeys_IT4U,Microsoft Word Tutorials - How to group objects in Microsoft Word  ,positive
VATIKANBE,Retweeted DAILY SABAH :Microsoft is determined to spread the use of cloud computing in ,positive
cryptoworldnews,"Microsoft Blocked More Than 400,000 Malicious Cryptojacking Attempts In One Day  ",positive
darrenculbreath,"Blocked More Than 400,000 Malicious  News   ",positive
SportsbookBTC,"Microsoft Blocked More Than 400,000 Malicious Cryptojacking Attempts In One Day via †’ ",positive
eStream_Studios," Microsoft Blocked More Than 400,000 Malicious Cryptojacking Attempts In One Day ",positive
MariaDa18810214,"Vertex One Asset Management Has Cut Its Holding in Microsoft MSFT by $481,000; As Kohls Call KSS Shares Decli ",positive
stonemirror,"Yeah, Im sure Im missing some very important Microsoft Paint documents with red circles and arrows, n ",positive
MorrisarUF,Did make the Enchanted Mountains Financial website in Microsoft Word? Very bo ,positive
coinspectator,"Microsoft Blocked More Than 400,000 Malicious Cryptojacking     ",positive
MSFT_on_Reddit,Microsoft Announces MSIX Installer Format That Supports Both Win32 and UWP Apps submitted ,positive
cmattos,The  CEO Of The Year In The Cloud Wars: Microsofts Satya Nadella ,positive
Capita1_Gabriel,Mascotes:Microsoft=Master ChiefNintendo=MarioSega=SonicSony=PSN OFF,positive
Blawksy,"Microsoft Blocked More Than 400,000 Malicious  Attempts In One Day    ",positive
cryptonetix,"Microsoft Blocked More Than 400,000 Malicious Cryptojacking Attempts In One Day   ",positive
USSANews,"Blocked More Than 400,000 Malicious Cryptojacking Attempts In One Day -  ",positive
DatWolerin,No longer can use legacy Forced to used the new Its a piece of shit,negative
Wensumblogger,Russia to drop Microsoft in quest for national operating system  via ,positive
ABITCOINnews,"Microsoft Blocked More Than 400,000 Malicious Cryptojacking Attempts In One Day - ",positive
bitcoinexpert99,"Microsoft Blocked More Than 400,000 Malicious Cryptojacking Attempts In OneÂ Day  ",positive
TimPendry,Typical they completely corrupt the update database and then send you to a page of i ,negative
Bitcoins_for_u,"Microsoft Blocked More Than 400,000 Malicious Cryptojacking Attempts In One Day *** Tinking ",positive
ico_expert,"New on crypto planet: Microsoft Blocked More Than 400,000 Malicious Cryptojacking Attempts In One Day | March 10, 2 ",positive
BitcoinNewsPage,"Microsoft Blocked More Than 400,000 Malicious Cryptojacking Attempts In One Day  via  ",positive
tradebuddyonlin,"Microsoft Blocked More Than 400,000 Malicious | News Microsofts Windows Defender Antivirus has ",positive
GuaripeteSol,"Microsoft Blocked More Than 400,000 Malicious Cryptojacking Attempts In OneÂ Day ",positive
DavidMBelle3,I liked a video  Microsoft Already Won E3! The Biggest Unannounced Game Of The Year Will Be At,positive
SocialMediaVila,"Microsoft Blocked More Than 400,000 Malicious Cryptojacking Attempts In One Day F ",positive
JeanSTLively,"is with team members from Microsoft, IBM, Adobe, etc Check out your team members and your advisor I wi ",positive
GonelfCrypto,"Microsoft Blocked More Than 400,000 Malicious Cryptojacking Attempts In One Day *** Tinking abo",positive
BitcoinNewsAus," Microsoft Blocked More Than 400,000 Malicious Bit - ",positive
arctoplabs,There is a new coming! Just imagine what is possible with and - Hope to hea,positive
budejicky,"Microsoft Blocked More Than 400,000 Malicious Cryptojacking Attempts In One Day | - ",positive
Cointelegraph,"Microsoft stops over 400,000 cryptojacking attempts ",positive
cronsysctr,Microsoft announces new MSIX app packaging format -  ,positive
triuvare,Microsoft Teams: guest access   ,positive
KhanalAryan,"With this update, you can leave comments, assign tasks ; mention coworkers in shared Microsoft Office files without having",positive
NUTTB_COM," Microsoft stops over 400,000 cryptojacking attempts ",positive
Crazy_Golfer,Microsoft is always two years away from failure - Bill Gates,negative
rgprachi,"What Design Chiefs At Uber, IBM, And Microsoft Care About In 2018“And Why ",positive
NrthrnEditorial,How to Delete Styles in Microsoft Word ,positive
digitalminernet,"New post Microsoft Blocked More Than 400,000 Malicious Cryptojacking Attempts In One Day has been published on Di ",positive
TheRaanger,indeed,positive
kirimba,Microsoft Word a lamentable situation Admit it! Coloniser who wakes up too lat ,positive
Synergy_App,What features do you like about the app?,positive
aliguclu,"Cointelegraph : Microsoft stops over 400,000 cryptojacking attempts via Twitter ",positive
plebouc,"Microsoft Hololens 2 Teased By Alex Kipman, Will Feature Cloud-assisted AI | SegmentNext   ",positive
Bitcoin_Spain,"Microsoft Blocked More Than 400,000 Malicious Cryptojacking Attempts In One Day:   ",positive
quyendoattt,"Best New “ Microsoft Blocked More Than 400,000 Malicious Cryptoja |Â News ",positive
shelfstock,Transform your industry with new Microsoft IoT in Action webinar series  ,positive
OttLegalRebels,Microsoft Bolsters Artificial Intelligence Services And Powers Progressives Chatbot via ,negative
Techynewssource,Microsoft: Proposed Digital Geneva Must Neutralize Nation-State Cyberattacks - Warehouse Discounts ,positive
megilevin,"Cointelegraph Microsoft stops over 400,000 cryptojacking attempts ",positive
BitcoinUpdated,"Microsoft stops over 400,000 cryptojacking attempts  ",positive
cryptonewsim,"Microsoft Blocked More Than 400,000 Malicious Cryptojacking Attempts In One Day has been published on Crypto ",positive
coinmoon_com,"Microsoft stops over 400,000 cryptojacking attempts ",positive
TheBitcoinNews,"Microsoft Blocked More Than 400,000 Malicious Cryptojacking Attempts In One Day - Advertise ",positive
crypto_jane,"Microsoft Blocked More Than 400,000 Malicious Cryptojacking Attempts In One Day: ",positive
w4yneKER,"Microsoft stops over 400,000 cryptojacking attempts  :  $btc $eth $pay $neo $sec $sc",negative
cryptonews_us,"Microsoft Blocked More Than 400,000 Malicious Cryptojacking Attempts In One Day",positive
W4W_Global,Leading Tech Companies Unite To Reduce Online By 80% In Next 2 Years: +,positive
naniiyer,"Microsoft says AI and cloud computing are giving precision medicine a boost, including award to Kaiser and for AI and",positive
Juanma0832,Superscale workloads are moving to at breakneck speed That bodes well for Microsoft Azure ,positive
LizzieGadd,"Interesting thought: Like Microsoft, Google and Walmart, publishing houses have a legal responsibility to avoid di ",positive
CLundyWrites,"I gave it a try, but Outlook is absolutely awful I dont want my emails sorted automatically Its alwa ",negative
kaleem_ullah525,Mail Merge in Microsoft Word in Pushto/How to make DMC in excel/word:  via ,positive
