adil_gazdar,Learn how to track your online Microsoft store order:  ,positive
morvjn,GAFA are more aggressive than IBM or Microsoft in snapping up potential new competitors ,positive
danielko,Brian Harry takes a year leave from Microsoft ,positive
itboxgr,Microsofts Preparing a Free Version of Teams to Take on Slack - ,positive
A_Bansal,"Theme- FREE Full-day DPG event @ Microsoft, Domlur, BLR On March 17, Saturday Sessions o ",positive
yuritepetl,yuritepetl played Microsoft Solitaire Collection Windows 10 in the last 24 hours ,positive
pgartenberg,A profile of our colleague who joined our company so she could do more to fight climate change ,positive
CsharpCorner,on Integrating with will start in one hour See you there: ,positive
mhfree_com,New post Download [Udemy] Microsoft Access VBA for Non Programmers Free has been published on ,positive
Aspnet_Tips,Create a Windows Modbus Master Program using Microsoft NET˜ ,positive
WebSecurityNews,"Hackers Target 400,000 Computers with Mining Malware - Microsoft claims that Windows 10, 81, and Windows 7 compute ",positive
ComputateUK," Microsoft Office Master Specialist, whatever your skill level we can help ",positive
ComputateUK," Microsoft Office Master Specialist, whatever your skill level we can h ",positive
siudeal,Microsoft Surface Pro 4 Core i5 128GB 123 Tablet Open Box $500 at BLINQ ,positive
ComputateUK," Microsoft Office Master Specialist, whatever your skill level we can hel ",positive
ComputateUK," Microsoft Office Master Specialist, whatever your skill level we can ",positive
bpdxbox,Microsoft  One X 1TB Console Black New Call of Duty WW2 Bundle   ,negative
ComputateUK," Microsoft Office Master Specialist, whatever your skill level we can he ",positive
mamasmoney,Going Back to School With Microsoft    ,positive
V_K_SAS,"Theme- FREE Full-day DPG event @ Microsoft, Domlur, BLR On March 17, Saturday Sessions on ",positive
cmendibl3,The new world needs a new model for digital identity and  wants to use  to secure yours ,positive
EnaPsychic, on Integrating  with will start in one hour See you there: ,positive
gamerdrops,"Call of Duty: Black Ops III Microsoft Xbox One, 2015 In New Condition!!    ",positive
GameDesign_Zozo,Microsoft Excel for Project Management - Earn 5 PDUs˜ ,positive
Najiboss31,How about banjo since Microsoft are cool with him being in smash,positive
ayyee_its_j,Does anyone want a job at Microsoft?,positive
albertspijkers,"Hackers Target 400,000 Computers with Mining Malware - Microsoft claims that Windows 10, 81, and Windows 7 computers",positive
jobullard123,The Microsoft team in 1979 ,positive
CodesWholesale,New Deal: Microsoft Office Professional Plus 2016Price:‚¬1755 Delivery:24h Just 24h left! ,positive
blynksolutions,10   business benefits in one convenient list  from ,positive
MikeReading,Did you know that is a really motivating activity for descriptive or recount writing? ,positive
Tsundu_Mak,"Microsoft Pix can scan business cards to your contacts, find people on LinkedIn   ",positive
ZDNet,Microsoft is selling the Samsung Galaxy S9 Android phone  ,positive
CourseGift,"New Amazon AWS Course in 3 hours*Cloud Load Balancer on AWS, Google Cloud and Microsoft Azure*GET HERE - ",positive
atechfreak,The issue is not with my ISP the issue is in the Microsoft CDN through which Xbox data is being routed!!!,positive
adesignmedia,is selling customized phones -- users who are fans of ,positive
natisho,"There is not a ˜Microsoft Edition brand of any Samsung Galaxy products,So ironic that Microsoft has so much le ",positive
suniltristar,"Microsoft starts selling customised Samsung Galaxy S9, S9+ ",positive
wrkelly1, anyone please help My son playing COD black ops two Last couple of weeks gets UI ERROR 606 ,negative
carsten_heins,Microsofts Windows Defender ATP Catches Law Enforcement Spyware - ExtremeTech  via ,positive
OlympiaReport,Critical Review: Microsoft $MSFT and Alteryx $AYX ,positive
Retweets2017, anyone please help My son playing COD black ops two Last couple of weeks gets UI ERROR 60650 and can,negative
jnberenger,"Pix can scan business cards to your contacts, find people on   via ",positive
SwearyRobot,Microsoft courts US government just makes me sad,negative
Foone,I checked for a movie and one of the places that came up was Microsoft trying to sell it to me I didnt realize th ,positive
micsant1,Microsoft is selling its own custom version of Samsungs Galaxy S9 ,positive
seasnake17,Anyone have an Xbox Live code that I may please use?,positive
ViewsFromDennis,Throwback to a great Santa Kizer event was generous enough to help surprise 4 familys with,positive
Blackfang_WSB,my Microsoft pre-order just completed and said is available for download Whats going on there then?,positive
HavasuPromos,$20 Off @ $50 Off Microsoft Office Home and Business 2016 Product Key ,positive
shorelineit,Microsoft Word Gets Update To Disable DDE After Malware Concerns ,positive
Pixiestik1,Microsoft Updates Its iPhone Camera App to Scan Business Cards ,positive
Pixiestik1,Microsoft Updates Its iPhone Camera App to Scan Business Cards  via ,positive
starwispy,Dear I hate you ,negative
geekbbs,"Between 2015 and 2016, it is time for Chinese insider users to be very active, because Microsoft is wi ",negative
Emdecay,Im a Navy seal and my dad owns Microsoft And i stole 10 quid worth of sweets from the local shop I can cut over ,positive
MobileStarts,New post: Microsoft now taking pre-orders for its versions of the Galaxy S9 and Galaxy S9+ ,positive
KalokolB,Kudos for feeding the world ,positive
MasterrKaran,Five strategies for landing a job at Microsoft according to    ,positive
tuderich,What happened to the good old times when Microsoft had beautiful fonts that looked like calligraphic handwriting?,positive
Excel_4you,Microsoft Excel - From Beginner to Expert in 6 Hours˜ ,positive
_softwarecloud_,Microsoft will let government clients run its Azure cloud technology on their own servers ,positive
SaschaF80,Microsoft Confirms That Surface Hub V2 Is Coming ,positive
BOOTYSEXYGIRLS,"CAUTION : DONT DO WINDOWS UPDATE , THEY ARE BAD AND SHUT DOWN THE PC !! ? A SHAME ! I said it to Microsoft ˜ ˜®˜",negative
kevin_sait,Did you know that    is a really motivating activity for descriptive or recount writing? ,positive
TechRadarME,"Surface Hub 2 is actively in the works,  teases   ",negative
djscopeman,10 tips for better laptop battery life with Windows 10: Jesusegun Alagbe With Microsofts ,positive
TECHKNOWDay,// Microsoft Mixed Reality - Blending the physical and the digital by ; for  ,positive
TECHKNOWDay,Thank you everyone who attended my workshop on building AI applications using Microsoft Cognitive Services Please find,positive
gjohri,"Had a wonderful meeting with our friends at and Rajiv, Natraj, Sudheer, Nithya Prachi, Ni",positive
alanjarvisjr,"Increase Agility, Productivity, ; Efficiency w/ HPE Gen10 Servers + Microsoft Windows Server 2016 ",positive
cloudandazure,Read about how Evangelist boomeranged back to Microsoft via h,positive
atreidae,Microsoft to unveil new Surface Hub 2 displays in coming months  ,positive
naebD,He created the Lothian expansion pack for Microsoft Truck Simulator Labour of love,positive
MagpieMcGraw,"Microsoft is not at all shy about shoving Microsoft Edge in your face Have some class, you jerks I can choose wha ",negative
DaveThackeray,"Hey, - just wrote you a love letter made from chips ",positive
Marketing__Pro,Microsoft Excel 2016 Beginners ; Intermediate Excel Training˜ ,positive
im_prettymess,Microsoft officePowerpointExcel,positive
Finance_Blogss,"Microsoft Access VBA, Design and Advanced Methods Workshop 4˜ ",positive
FutureQTech,MSBI online training         ,positive
Learn_Excel_,"Microsoft Access VBA, Design and Advanced Methods Workshop 2˜ ",positive
ReginaLewis,Im Microsofts Head Of Talent: Heres How To Get Hired ,positive
widestuk,Apple MacBook Pro with Microsoft Office 365 Home     ,positive
bvaibhav95,Introduction to typescript by Microsoft   ,positive
oneefficiency,need iOS in their own HQs infrastructure - Reading UK failed a dsar  ,positive
Ashot_, expands to help customers get better by moving Server and applications t,positive
benxgreen,"Just found Mouse without Borders and it is AMAZING! Being able to control my laptop and PC, drag and dro ",positive
BenefitRx,Microsoft launches new AI and Cloud Computing tools for intelligent health ,positive
Himbapinfo, on Integrating   with  by  Register now: ,positive
OlympiaReport,"Barings LLC Purchases 16,600 Shares of Microsoft Co $MSFT ",positive
CB_Resourcing,Security Center And Microsoft Web Application Firewall Integration Via  ,negative
PrakashMallya,Intel and Microsoft Enable AI Inference at the Edge with Intel Movidius Vision Processing Units on Windows ML ,positive
j3ss1kP,Microsoft/AzureStorageExplorer is a new repository by Microsoft Easily manage the contents of your storage account with Az,positive
Radio_Jacob,You should see the shit I get from Microsoft for using chrome!,negative
supoet,Just completed the My Minecraft Journey course!   via ,positive
francoleuzzi,"I had an AMAZING time with these Microsoft women at  last night! Thanks for all of your hard work, ",positive
jczamora,"Paul Allen, the co-founder of Microsoft, has put his money into many passion pursuits Underwater archaeology”specificall",positive
Cjhon05,Microsoft Pix Updated ,positive
dir__business,"Major update coming for Windows 10 has the name  Spring Creators Update |||Microsoft, Operating systems, Spring ",positive
robvank,"which you throw the party Google, Amazon, Ebay, Microsoft, IBM, Apple, play on that table and they get richer ever ",positive
egamingforums,"NBA 2K18 Microsoft Xbox One, 2017NO TAX! ",positive
seemaduggal1,"Microsoft Imagine Academy teachers! When you rack up Microsoft Educator badges ; points, youre showing off your ex ",positive
petrus_79,New Tool: Microsoft Teams Bulk Policy Tool - Anthony Caragols Skype for Business and -   ,positive
Xletricity,"I like how the Microsoft logo is cut off, though XDLike they forgot to expand the width of the div",positive
francoleuzzi,Its the last day at the and we were curious to know about what ; has to say ab,negative
krishdtech,Microsoft says Windows Defender saved half a million PCs from crypto-mining malware ,negative
BOOTYSEXYGIRLS,En rÃponse Ã  YOURS WINDOW 7 - 8 UPDATES ARE SO BAD : MY PC WORK NOT !!?? when I do windo ,negative
marknhenry,"Exciting, scary and arguably borderline ethical/bioethical making its mark with If you ",negative
WallSt_Look,HHS: Microsoft Vulnerabilities Impact Healthcare Cybersecurity ,positive
bradrevell,Loving The flexibility across my and with and takes ,positive
SJRussellJr,"Dominion so proud of our CIS students, now at 54+ Microsoft Office Specialist certifications in PowerPoint, ",positive
Khalidbintory,What apps?,positive
TheDragerboy,"Hi there, I am a UK user of an Xbox One X having a terrible time with Microsoft Customer Support with my ",negative
henrihoward,"Thats below belt from a former stateman, these were gifts from Microsoft and not a loan",positive
JohnLamont,Todays car Its like theyre running Windows XP at the dawn of the internet and you know Microsoft nev ,positive
theHCCL,Part 2 of 4 Real Page Vs Microsoft HCCL RED 12:  via ,positive
theHCCL,Part 1 of 4 Real Page Vs Microsoft HCCL RED 12:  via ,positive
theHCCL,Part 3 of 4 Real Page Vs Microsoft HCCL RED 12:  via ,positive
theHCCL,Part 4 of 4 Real Page Vs Microsoft HCCL RED 12:  via ,positive
Worrelpa,"Advice from an IT pro and Microsoft MVP on joining the program, especially for people wanting to join wit",positive
LukasHakos,"Amen, from     ",positive
SJRussellJr,"so proud of our CIS students, now at 54+ Microsoft Office Specialist certifications in PowerPoint, W ",positive
mutoamatenka,Empower your employees with the Secure Productive Enterprise - The Official Microsoft Blog windows 10 upgrade not s ,positive
GrateStuff4U,"March 10, 2018 at 10:00AM Check out Xbox One X 1TB Console by Microsoft ",positive
endor137,Microsoft Solitaire Collection - Spider [Medium] | March 11th 2018: Solve the deck:  via ,positive
endor137,Microsoft Solitaire Collection - FreeCell [Hard] | March 11th 2018: Play 3 Sevens to :  via ,negative
CatLondonUK,Microsoft Courses - Excel Intermediate  Duration 1-Day Website  ,positive
albertspijkers,Have questions about Citrix on We teamed up with Microsoft Cloud Solution Architect Jeff Mitchell to answer a few ,negative
bpdxbox,Microsoft  One S FIFA 17 Bundle 500GB White Home Console and 2 games   ,positive
MindSpeakApps,Document Writer for  Office -  ;  for  ;  Via  ,positive
anewscomtr,"Microsoft is determined to spread the use of cloud computing in Turkey, where a digital transformation has already ",positive
MicrosoftSB,"To ensure everyone in the UK can upskill and reskill, Microsoft is committed to offering digital skills courses fro ",positive
juykacangul,Hear from Microsoft leader on how you can get noticed by recruiters and land your dream job! ,positive
RamonTonnaer, All About Microsoft Shine 2016 ,positive
henriktudborg,"I use truecaller, which is annoying, but less annoying than getting calls from Microsoft support all the time",negative
endor137,Microsoft Solitaire Collection - Klondike | March 11th 2018: Play the 7£ to the Foundation: via ,positive
kevin_sait,"Microsoft Imagine Academy teachers! When you rack up Microsoft Educator badges ; points, youre showing off your expertis",positive
endor137,"Microsoft Solitaire Collection - Pyramid | March 11th 2018: Earn a Score of 1,900:  via ",positive
amtevolve,Got a minute? Heres Office 365 in a nutshell ,positive
endor137,Microsoft Solitaire Collection - TriPeaks [Medium] | March 11th 2018: Clear 2 Boards in 2 deals:  via ,positive
CoyoteCloud46,The team is heading to this week to talk ; Come say hi at booth ht,positive
CoyoteCloud46,On the eve of lets celebrate and encourage the next generation of female leaders in STEM ,positive
vCloud_Storage, Security Center And Microsoft Web Application Firewall Integration Via  ,negative
TheDragerboy,"Hi there, Im a UK user of a One X and I am having a terrible time with Microsoft Customer Support deali ",negative
iamshainefisher,Youd think that considering own and they could string together a working ,positive
Khumairo13,At Microsoft Joburg with for the conference and its raining!? ,positive
lindsypaul1,70-705 Designing and Providing Microsoft Licensing Solutions to Large Organizations ,positive
BsFinance123,Deploy Microsoft Dynamics 365 For Businesses MB2-715 Exam˜ ,positive
o365,ICYM: Introducing the Admin Center - a single place for admins to get started with Microsoft 365,negative
carpseo,Weird that since got taken over by Microsoft its functionality has got steadily more obfuscated and unrel ,positive
TechNewsWorldEn,"Major update coming for Windows 10 has the name  Spring Creators Update | Microsoft, Operating systems, Spring C ",positive
marinadelice69,Excited to share with you all some of the exciting work Im doing with and The First Down Fund to help chil,positive
GamersConnecti1,Microsoft suggests Fortnite PS4 vs Xbox One cross-play could happen,positive
ejoyen,WebVR motion controller now supported in Microsoft Edge EdgeHTML 16 and optimized for PCs or Ultra PCs ,positive
demirbasayyuce,This is why I love Live long and prosper –– ,positive
nSay_7,Microsoft Office 2016 Product Key   ActivatorÂ [Cracked] ,positive
BrianCVC,"Be careful, Aman Microsoft might fire you for that ;-",negative
saadshake,"Theres the entire MS Office suite, an SMS organizer, a to-do list manager, Microsoft Len ",positive
parameter_less,Microsoft is selling its own customized version of the Samsung Galaxy S9 [028]: ,positive
vishalsehijpal,These translation tools seriously need        ,negative
AJBCSurveys,Just in Microsoft Confirms That Surface Hub V2 Is Coming  via  ,positive
joseFreedomVE,"46% off, 853 Reviews: Microsoft Surface Book 128 Gb 8 Gb Ram Intel Core I5 May apply additional discount of 55% o ",positive
weebtrash1089,"If Microsoft Word is a Steam game, I wonder how many hours Ive clockedIve written fan-fictions with 2500 words a day I",positive
SuperDealsite,” Hot Gaming Deals!Vinyl Skin Decal for Microsoft Xbox One Elite Wireless Controller for $999! ,positive
JaxxAI,"So I finally got around to trying Microsoft Edge on Android Its a very good port, fast too Cant complain",positive
crneruze,"Look, I really want to treat myself with a MacBook but Ill need Microsoft office on it and Ill have to pay extra ",negative
parameter_less,Microsoft is selling customized Samsung Galaxy S9 phones [-002]: ,positive
whaledust, Microsoft word bong : ,positive
___Alexaaa___,Hi I bought Microsoft office lifetime one user and this has popped up? Is this right for a lifetime ,positive
dotnetkicks,Microsoft…releases automation for HIPAA/HITRUST compliance by Azure via DotNetKicks,positive
invent_therapy,Microsoft is selling its own customized version of the Samsung Galaxy S9 ,positive
parameter_less,Microsoft Pix can add business card info to your contacts [027]: ,positive
MoneyHealthFina,Microsoft: Switching out of Windows 10 S Mode will be free forÂ all  ,positive
freecouponarena,Microsoft Surface Book$46 OFF Microsoft Surface Book Intel Core i7 6600U 260 GHz 16GB Mem 512GB SSD NVIDIA GeF ,positive
CoyoteCloud46,Learn more about how uses  and to make  a reality  ,positive
namroud,"What Design Chiefs At Uber, IBM, And Microsoft Care About In 2018“And Why ",positive
AlchemySystems,Learn how Agents for Windows ; for can be deployed and managed directly from the Veeam Bac ,positive
D4RKN3Z,Microsoft suggests  vs cross-play could happen ,positive
SaschaF80,Identity-driven security”Enterprise Mobility + Security | Microsoft ,positive
lucap261,"As we make our own operations more sustainable, its great to see how can help grow renewable energy around th",positive
bgdftw,Why Microsoft Has to Love iPhones and Android ,positive
VirtualJonas,Noticed a recent update in Microsoft Guests can now join a team with a consumer ie free Microsoft accoun ,positive
meedeeny,"At Microsoft, I got deep into computer science At the foundation, its computer science plus biology, chemistry, agronomy,",positive
micka39,Microsofts Windows Defender prevents massive coin mining attack:  via ,positive
FernanSQL,Why Microsofts mobile future may depend on eSIM ,positive
Noctis_Solaith,Microsoft Developer Day : mode S et machine learning local pour Windows 10  via ,positive
CoventryUpdate," Senior Cloud Consultant / Azure Developer Azure, NET, Coventry: Client: Microsoft Gold",positive
AlistairPugin,Microsoft readies second version of its Surface Hub conferencing system  via ,positive
Njokie_,"This competition is the doorway to your success If you can win here, you can win anywhere All you need to do is: Have a",positive
dougpete,Microsoft is now selling its own edition of Samsungs Galaxy S9 via ,positive
blog_afraIT,There is a new coming! Just imagine what is possible with and - Hope ,positive
Philsaboti,Please educate is Microsofts donation going to the teacher or to Ghana as a count ,positive
Franz_gr,True brand experience through computer games and eSports: and launch partnership More: ,positive
DigbijayTOI,Techstars hires former Microsoft Accelerator India chief to head India operations ,positive
JayeetriTia,I added a video to a playlist  Excel Fun Formula Magic tips - Microsoft excel tutorial in Hindi,positive
modery,Three ways to convert HTML to PDF using Microsoft Flow  via ,positive
donnagolightly1,Here are some quick tips for how to get into using Microsoft Paint 3D in your class ,positive
amit21anku,Giveaway! As promised I am giving away TWO Surface Pros in honor of its 5th anniversary To enter 1 foll,positive
Yorunaga_,Why Microsoft Has to Love iPhones and Android  ,positive
faizaskari,Selling Customised   S9+  ,positive
shekharreddyg,Microsoft Surface Pro LTE review: the true mobile computer is here - The Verge ,positive
shokibt,Do you know how to choose the best  solution for your environment?   ,positive
guimikowski,Microsoft House of Fans Program Wins Top Com Grand Prix ,positive
UPiynar,I didnt even know that there was a Microsoft Translator :D,positive
robmonti,Microsoft gives devs more  goodies Read via ,positive
Ricc_Mic,"Microsoft Pix can scan business cards to your contacts, find people onÂ LinkedIn  via ",positive
SadStuff10,Microsoft will reveal their hidden desire for the sweet relief of cold drinks on a hot day The birth of the anti- ,negative
jane_ayres12,Microsofts Cortana speaker will go the way of the Zune       ,positive
donnagolightly1,Hurry and register to   and Minecraft Education Edition for your classroom and school  ,positive
santifl05,Next major update of Windows 10 could include a special S Mode feature to tune-up Windows for security and perf,positive
parameter_less,"Microsoft Pix can scan business cards to your contacts, find people on LinkedIn [024]: ",positive
shopseasonal,Microsoft: Switching out of Windows 10 S Mode will be free for all Video: First Windows 10 S laptops under $ 300 ma ,positive
RoccoTerlizzi,Must read“–How Always Connected PCs may turn carriers in Microsofts favor: ,positive
categoryx,"Amazon, Oracle, Microsoft jockey for Pentagons cloud business ",positive
robmonti,CEO opens up about the influences that inspire his vision for Microsofts future ,positive
sanyutama,SAMSUNG DEX Microsoft Office 365 EXCEL Features S9 S9+ S8 S8+ Note8 | Detail Experience:  via ,positive
_PhilDawson,News: launches offering for UK - extends companys strategy for tho,positive
RussellMarsh,"What Design Chiefs At Uber, IBM, And Microsoft Care About In 2018“And Why ",positive
duplosconradi,"Great news for The worlds 21 top tech companies, incl Alibaba, Facebook, Google ; Microsoft, unite to fight ",positive
Tok39Larraby,Microsoft could leverage LinkedIn to dominate the business software world MSFT | ,positive
m_vegeta1,"Hey Microsoft, I have installed the Build 17618, but I dont have Sets How can I activate this?",positive
demirbasayyuce,Bing Translator ,positive
MDriessen,Microsoft predicts everyone will soon have an AI second self to boost intelligence ,positive
duty4lazaro1,MSDAT: Microsoft SQL Database Attacking Tool ,positive
ramiyengar, can help your business grow and strengthen your partnership with Microsoft! ,positive
alice14wells,When I die itll say in my obituary He really used that Microsoft Word paint brush feature like a fuckin pro,positive
YvonneMurrayNSW,Data Wins Whole of Australian Government Microsoft Licensing Solutions Provider Contract:  ,positive
J3RMeyer,3 scenarios on what to do with public folders when migrating to    ,positive
SaschaF80,Global MVP Summit 2018 was Awesome   ,positive
webshotdesigns,Microsoft announces the death of Wunderlist  ,positive
eziadvertising,Microsoft announces the death of Wunderlist ,positive
SaschaF80,Keeping an Eye on AI with Dr Kate Crawford - Microsoft Research ,positive
startupcrunch,Techstars hires Microsoft accelerators India head to lead local incubation ,positive
mbj36,Full house at for React Meetup  ,positive
BuyGamesCheap,"Kinect Sports Rivals Only on Microsoft Xbox One, 2014 Requires Kinect to Play# ",positive
Adamilkbot,Critical alert from Microsoft Your computer has alerted us that it is infected with a virus and spyware This virus is sending your credi,positive
ricardoschiller,ju,positive
SkoolerUK,The latest The Microsoft Teams for education Daily!  Thanks to  ,positive
jdaykin,"Haha, our Microsoft team at my old agency used to moan a but then the later ones got much bette ",positive
aneillans,Who can put me in touch with someone at Microsoft Startups? ,positive
egamingforums,Microsoft Xbox One Halo 5: Guardians Limited Edition 1TB Black ; Silver Console  ,negative
AbrantieKayJr,"If you dont want ˜Aid, reject Microsofts donation “ |More here: ",positive
Janaki_ramank,Microsoft Inks First Renewable Energy Deal In India | CleanTechnica ,positive
Bellz2012,I am starting to think Microsoft are doing something similar to what Apple was doing with their IPhones,positive
WatchlistN,"Commonwealth Bank of Australia Acquires 19,624 Shares of Microsoft Co $MSFT ",positive
Ehickioya,Using Search Folders in Microsoft Outlook  ,positive
SaraDiDonna,The  CEO Of The Year In The Cloud Wars: Microsofts Satya Nadella via ,positive
TunguzReview,"Digital Wars: Apple, Google, Microsoft and the Battle for the Internet - Book Review  ",positive
Unlock__Zone,Microsoft now taking pre-orders for its versions of the Galaxy S9 and Galaxy S9+ -  ,positive
Bellz2012,I think you are intentionally causing Windows 10 to have problems so that people will pay for that service,positive
Coin_Fool,Fuck and Get yourself a computer   ,negative
fsocdatcs30,"Microsoft detected a new mining malware campaign that infected over 500,000 computers in just few hours",negative
punitrai032,When you have offer letter of Microsoft but your crush in small company ˜ ,negative
miamou589,"Microsoft just hit its $20 billion goal, almost a year ahead of schedule Read more here and contact the ",positive
bpdxbox,Microsoft  One X 1TB Black Console   ,negative
jshupper,Join and select MVPs at our Roundtable this April! Well cover how you ca,positive
Mr_FatLoss,Microsoft dimwits seem to have no idea what an epic failure their Always ÌCÌoÌnÌnÌeÌcÌtÌeÌdÌ Compromised PCs ar ,negative
AtlanticFanboy,"Either all the Tweets I want to translate, translate to Could not translate Tweet or Microsoft cant translate for nothin",positive
Cjsc00by,For the new generation of designers at Microsoft our what is being force to collide with our how As we build empathy,positive
astgarrido,"----In the following series of tweets, I am going to use languages that fortunately Google Translate or Microsoft T ",positive
TheMKMaestro,Microsoft suggests Fortnite PS4 vs Xbox One cross-play could happen  ,positive
